workspace/logs/conv2d_8_64_56_64_3_1_1_1_int4_4000_600.log
{"input": ["cuda -keys=cuda,gpu -max_num_threads=1024 -thread_warp_size=32", "conv2d_HWNCnc_tensorcore.cuda", [["TENSOR", [56, 56, 8, 64], "int4"], ["TENSOR", [3, 3, 64, 64], "int4"], 1, 1, 1, "int32"], {}], "config": {"index": 313632, "code_hash": null, "entity": [["block_row_warps", "ot", 1], ["block_col_warps", "ot", 1], ["warp_row_tiles", "ot", 8], ["warp_col_tiles", "ot", 16], ["chunk", "ot", 2], ["split_block_k_nums", "ot", 1], ["vector_ws", "ot", 1], ["vector_as", "ot", 16], ["reorder_inner", "re", [1, 0]], ["AS_double_buffer", "ot", 0], ["WS_double_buffer", "ot", 0], ["auto_unroll_max_step", "ot", 512]]}, "result": [[8.90624890617404e-05], 0, 1.7591805458068848, 1638171409.6886246], "version": 0.2, "tvm_version": "0.8.dev0"}
