workspace/logs/conv2d_8_64_56_64_3_1_1_1_int4_4000_600.log.tmp
{"input": ["cuda -keys=cuda,gpu -max_num_threads=1024 -thread_warp_size=32", "conv2d_HWNCnc_tensorcore.cuda", [["TENSOR", [56, 56, 8, 64], "int4"], ["TENSOR", [3, 3, 64, 64], "int4"], 1, 1, 1, "int32"], {}], "config": {"index": 773630, "code_hash": null, "entity": [["block_row_warps", "ot", 4], ["block_col_warps", "ot", 4], ["warp_row_tiles", "ot", 8], ["warp_col_tiles", "ot", 2], ["chunk", "ot", 4], ["split_block_k_nums", "ot", 2], ["vector_ws", "ot", 8], ["vector_as", "ot", 16], ["reorder_inner", "re", [1, 0]], ["AS_double_buffer", "ot", 1], ["WS_double_buffer", "ot", 1], ["auto_unroll_max_step", "ot", 1500]]}, "result": [[0.0008232539800000001], 0, 3.378506898880005, 1638169555.62164], "version": 0.2, "tvm_version": "0.8.dev0"}
{"input": ["cuda -keys=cuda,gpu -max_num_threads=1024 -thread_warp_size=32", "conv2d_HWNCnc_tensorcore.cuda", [["TENSOR", [56, 56, 8, 64], "int4"], ["TENSOR", [3, 3, 64, 64], "int4"], 1, 1, 1, "int32"], {}], "config": {"index": 277869, "code_hash": null, "entity": [["block_row_warps", "ot", 1], ["block_col_warps", "ot", 2], ["warp_row_tiles", "ot", 16], ["warp_col_tiles", "ot", 16], ["chunk", "ot", 4], ["split_block_k_nums", "ot", 4], ["vector_ws", "ot", 8], ["vector_as", "ot", 8], ["reorder_inner", "re", [0, 1]], ["AS_double_buffer", "ot", 0], ["WS_double_buffer", "ot", 0], ["auto_unroll_max_step", "ot", 512]]}, "result": [[0.00048115570118343194], 0, 1.9883098602294922, 1638169556.4468398], "version": 0.2, "tvm_version": "0.8.dev0"}
{"input": ["cuda -keys=cuda,gpu -max_num_threads=1024 -thread_warp_size=32", "conv2d_HWNCnc_tensorcore.cuda", [["TENSOR", [56, 56, 8, 64], "int4"], ["TENSOR", [3, 3, 64, 64], "int4"], 1, 1, 1, "int32"], {}], "config": {"index": 28030, "code_hash": null, "entity": [["block_row_warps", "ot", 2], ["block_col_warps", "ot", 2], ["warp_row_tiles", "ot", 16], ["warp_col_tiles", "ot", 4], ["chunk", "ot", 1], ["split_block_k_nums", "ot", 2], ["vector_ws", "ot", 8], ["vector_as", "ot", 16], ["reorder_inner", "re", [0, 1]], ["AS_double_buffer", "ot", 0], ["WS_double_buffer", "ot", 0], ["auto_unroll_max_step", "ot", 0]]}, "result": [[0.0005322460465838509], 0, 1.3766567707061768, 1638169557.8604155], "version": 0.2, "tvm_version": "0.8.dev0"}
{"input": ["cuda -keys=cuda,gpu -max_num_threads=1024 -thread_warp_size=32", "conv2d_HWNCnc_tensorcore.cuda", [["TENSOR", [56, 56, 8, 64], "int4"], ["TENSOR", [3, 3, 64, 64], "int4"], 1, 1, 1, "int32"], {}], "config": {"index": 17730, "code_hash": null, "entity": [["block_row_warps", "ot", 1], ["block_col_warps", "ot", 1], ["warp_row_tiles", "ot", 1], ["warp_col_tiles", "ot", 16], ["chunk", "ot", 4], ["split_block_k_nums", "ot", 2], ["vector_ws", "ot", 8], ["vector_as", "ot", 8], ["reorder_inner", "re", [0, 1]], ["AS_double_buffer", "ot", 0], ["WS_double_buffer", "ot", 0], ["auto_unroll_max_step", "ot", 0]]}, "result": [[0.00039190448806941436], 0, 1.4598255157470703, 1638169558.7535486], "version": 0.2, "tvm_version": "0.8.dev0"}
{"input": ["cuda -keys=cuda,gpu -max_num_threads=1024 -thread_warp_size=32", "conv2d_HWNCnc_tensorcore.cuda", [["TENSOR", [56, 56, 8, 64], "int4"], ["TENSOR", [3, 3, 64, 64], "int4"], 1, 1, 1, "int32"], {}], "config": {"index": 192476, "code_hash": null, "entity": [["block_row_warps", "ot", 4], ["block_col_warps", "ot", 1], ["warp_row_tiles", "ot", 2], ["warp_col_tiles", "ot", 4], ["chunk", "ot", 8], ["split_block_k_nums", "ot", 8], ["vector_ws", "ot", 8], ["vector_as", "ot", 16], ["reorder_inner", "re", [1, 0]], ["AS_double_buffer", "ot", 0], ["WS_double_buffer", "ot", 1], ["auto_unroll_max_step", "ot", 0]]}, "result": [[0.0005020865238095238], 0, 1.3947350978851318, 1638169560.1943166], "version": 0.2, "tvm_version": "0.8.dev0"}
{"input": ["cuda -keys=cuda,gpu -max_num_threads=1024 -thread_warp_size=32", "conv2d_HWNCnc_tensorcore.cuda", [["TENSOR", [56, 56, 8, 64], "int4"], ["TENSOR", [3, 3, 64, 64], "int4"], 1, 1, 1, "int32"], {}], "config": {"index": 194278, "code_hash": null, "entity": [["block_row_warps", "ot", 2], ["block_col_warps", "ot", 2], ["warp_row_tiles", "ot", 2], ["warp_col_tiles", "ot", 4], ["chunk", "ot", 8], ["split_block_k_nums", "ot", 32], ["vector_ws", "ot", 8], ["vector_as", "ot", 16], ["reorder_inner", "re", [1, 0]], ["AS_double_buffer", "ot", 0], ["WS_double_buffer", "ot", 1], ["auto_unroll_max_step", "ot", 0]]}, "result": [[0.0006920043828828829], 0, 1.3343594074249268, 1638169560.974699], "version": 0.2, "tvm_version": "0.8.dev0"}
{"input": ["cuda -keys=cuda,gpu -max_num_threads=1024 -thread_warp_size=32", "conv2d_HWNCnc_tensorcore.cuda", [["TENSOR", [56, 56, 8, 64], "int4"], ["TENSOR", [3, 3, 64, 64], "int4"], 1, 1, 1, "int32"], {}], "config": {"index": 670737, "code_hash": null, "entity": [["block_row_warps", "ot", 1], ["block_col_warps", "ot", 2], ["warp_row_tiles", "ot", 2], ["warp_col_tiles", "ot", 1], ["chunk", "ot", 2], ["split_block_k_nums", "ot", 2], ["vector_ws", "ot", 1], ["vector_as", "ot", 16], ["reorder_inner", "re", [0, 1]], ["AS_double_buffer", "ot", 0], ["WS_double_buffer", "ot", 1], ["auto_unroll_max_step", "ot", 1500]]}, "result": [[0.00018171842389006344], 0, 1.422689437866211, 1638169562.3857932], "version": 0.2, "tvm_version": "0.8.dev0"}
{"input": ["cuda -keys=cuda,gpu -max_num_threads=1024 -thread_warp_size=32", "conv2d_HWNCnc_tensorcore.cuda", [["TENSOR", [56, 56, 8, 64], "int4"], ["TENSOR", [3, 3, 64, 64], "int4"], 1, 1, 1, "int32"], {}], "config": {"index": 653418, "code_hash": null, "entity": [["block_row_warps", "ot", 1], ["block_col_warps", "ot", 1], ["warp_row_tiles", "ot", 4], ["warp_col_tiles", "ot", 1], ["chunk", "ot", 1], ["split_block_k_nums", "ot", 1], ["vector_ws", "ot", 8], ["vector_as", "ot", 1], ["reorder_inner", "re", [0, 1]], ["AS_double_buffer", "ot", 0], ["WS_double_buffer", "ot", 1], ["auto_unroll_max_step", "ot", 1500]]}, "result": [[0.0009054838775510204], 0, 1.7382798194885254, 1638169563.2423735], "version": 0.2, "tvm_version": "0.8.dev0"}
{"input": ["cuda -keys=cuda,gpu -max_num_threads=1024 -thread_warp_size=32", "conv2d_HWNCnc_tensorcore.cuda", [["TENSOR", [56, 56, 8, 64], "int4"], ["TENSOR", [3, 3, 64, 64], "int4"], 1, 1, 1, "int32"], {}], "config": {"index": 46203, "code_hash": null, "entity": [["block_row_warps", "ot", 1], ["block_col_warps", "ot", 4], ["warp_row_tiles", "ot", 8], ["warp_col_tiles", "ot", 2], ["chunk", "ot", 2], ["split_block_k_nums", "ot", 8], ["vector_ws", "ot", 1], ["vector_as", "ot", 8], ["reorder_inner", "re", [1, 0]], ["AS_double_buffer", "ot", 0], ["WS_double_buffer", "ot", 0], ["auto_unroll_max_step", "ot", 0]]}, "result": [[0.00010968439515151516], 0, 1.6065223217010498, 1638169566.403915], "version": 0.2, "tvm_version": "0.8.dev0"}
{"input": ["cuda -keys=cuda,gpu -max_num_threads=1024 -thread_warp_size=32", "conv2d_HWNCnc_tensorcore.cuda", [["TENSOR", [56, 56, 8, 64], "int4"], ["TENSOR", [3, 3, 64, 64], "int4"], 1, 1, 1, "int32"], {}], "config": {"index": 220374, "code_hash": null, "entity": [["block_row_warps", "ot", 1], ["block_col_warps", "ot", 1], ["warp_row_tiles", "ot", 2], ["warp_col_tiles", "ot", 4], ["chunk", "ot", 8], ["split_block_k_nums", "ot", 16], ["vector_ws", "ot", 1], ["vector_as", "ot", 16], ["reorder_inner", "re", [0, 1]], ["AS_double_buffer", "ot", 1], ["WS_double_buffer", "ot", 1], ["auto_unroll_max_step", "ot", 0]]}, "result": [[0.00012178403997194951], 0, 1.3915576934814453, 1638169567.2547343], "version": 0.2, "tvm_version": "0.8.dev0"}
{"input": ["cuda -keys=cuda,gpu -max_num_threads=1024 -thread_warp_size=32", "conv2d_HWNCnc_tensorcore.cuda", [["TENSOR", [56, 56, 8, 64], "int4"], ["TENSOR", [3, 3, 64, 64], "int4"], 1, 1, 1, "int32"], {}], "config": {"index": 153313, "code_hash": null, "entity": [["block_row_warps", "ot", 2], ["block_col_warps", "ot", 4], ["warp_row_tiles", "ot", 16], ["warp_col_tiles", "ot", 2], ["chunk", "ot", 2], ["split_block_k_nums", "ot", 4], ["vector_ws", "ot", 1], ["vector_as", "ot", 16], ["reorder_inner", "re", [0, 1]], ["AS_double_buffer", "ot", 0], ["WS_double_buffer", "ot", 1], ["auto_unroll_max_step", "ot", 0]]}, "result": [[0.0001726429756871036], 0, 1.340137243270874, 1638169568.634618], "version": 0.2, "tvm_version": "0.8.dev0"}
{"input": ["cuda -keys=cuda,gpu -max_num_threads=1024 -thread_warp_size=32", "conv2d_HWNCnc_tensorcore.cuda", [["TENSOR", [56, 56, 8, 64], "int4"], ["TENSOR", [3, 3, 64, 64], "int4"], 1, 1, 1, "int32"], {}], "config": {"index": 65632, "code_hash": null, "entity": [["block_row_warps", "ot", 2], ["block_col_warps", "ot", 2], ["warp_row_tiles", "ot", 4], ["warp_col_tiles", "ot", 8], ["chunk", "ot", 8], ["split_block_k_nums", "ot", 1], ["vector_ws", "ot", 1], ["vector_as", "ot", 1], ["reorder_inner", "re", [0, 1]], ["AS_double_buffer", "ot", 1], ["WS_double_buffer", "ot", 0], ["auto_unroll_max_step", "ot", 0]]}, "result": [[0.0002566830192307692], 0, 1.5036325454711914, 1638169569.5062213], "version": 0.2, "tvm_version": "0.8.dev0"}
{"input": ["cuda -keys=cuda,gpu -max_num_threads=1024 -thread_warp_size=32", "conv2d_HWNCnc_tensorcore.cuda", [["TENSOR", [56, 56, 8, 64], "int4"], ["TENSOR", [3, 3, 64, 64], "int4"], 1, 1, 1, "int32"], {}], "config": {"index": 448625, "code_hash": null, "entity": [["block_row_warps", "ot", 4], ["block_col_warps", "ot", 1], ["warp_row_tiles", "ot", 4], ["warp_col_tiles", "ot", 16], ["chunk", "ot", 2], ["split_block_k_nums", "ot", 1], ["vector_ws", "ot", 8], ["vector_as", "ot", 16], ["reorder_inner", "re", [1, 0]], ["AS_double_buffer", "ot", 0], ["WS_double_buffer", "ot", 1], ["auto_unroll_max_step", "ot", 512]]}, "result": [[0.0004893564678362573], 0, 1.6247942447662354, 1638169570.9091988], "version": 0.2, "tvm_version": "0.8.dev0"}
{"input": ["cuda -keys=cuda,gpu -max_num_threads=1024 -thread_warp_size=32", "conv2d_HWNCnc_tensorcore.cuda", [["TENSOR", [56, 56, 8, 64], "int4"], ["TENSOR", [3, 3, 64, 64], "int4"], 1, 1, 1, "int32"], {}], "config": {"index": 249903, "code_hash": null, "entity": [["block_row_warps", "ot", 1], ["block_col_warps", "ot", 1], ["warp_row_tiles", "ot", 4], ["warp_col_tiles", "ot", 8], ["chunk", "ot", 4], ["split_block_k_nums", "ot", 2], ["vector_ws", "ot", 1], ["vector_as", "ot", 16], ["reorder_inner", "re", [1, 0]], ["AS_double_buffer", "ot", 1], ["WS_double_buffer", "ot", 1], ["auto_unroll_max_step", "ot", 0]]}, "result": [[9.407539411157025e-05], 0, 1.387549638748169, 1638169571.7577574], "version": 0.2, "tvm_version": "0.8.dev0"}
{"input": ["cuda -keys=cuda,gpu -max_num_threads=1024 -thread_warp_size=32", "conv2d_HWNCnc_tensorcore.cuda", [["TENSOR", [56, 56, 8, 64], "int4"], ["TENSOR", [3, 3, 64, 64], "int4"], 1, 1, 1, "int32"], {}], "config": {"index": 118857, "code_hash": null, "entity": [["block_row_warps", "ot", 1], ["block_col_warps", "ot", 2], ["warp_row_tiles", "ot", 2], ["warp_col_tiles", "ot", 2], ["chunk", "ot", 1], ["split_block_k_nums", "ot", 1], ["vector_ws", "ot", 1], ["vector_as", "ot", 16], ["reorder_inner", "re", [1, 0]], ["AS_double_buffer", "ot", 1], ["WS_double_buffer", "ot", 0], ["auto_unroll_max_step", "ot", 0]]}, "result": [[0.00012165460869565216], 0, 1.360666036605835, 1638169573.1913457], "version": 0.2, "tvm_version": "0.8.dev0"}
{"input": ["cuda -keys=cuda,gpu -max_num_threads=1024 -thread_warp_size=32", "conv2d_HWNCnc_tensorcore.cuda", [["TENSOR", [56, 56, 8, 64], "int4"], ["TENSOR", [3, 3, 64, 64], "int4"], 1, 1, 1, "int32"], {}], "config": {"index": 595488, "code_hash": null, "entity": [["block_row_warps", "ot", 1], ["block_col_warps", "ot", 2], ["warp_row_tiles", "ot", 1], ["warp_col_tiles", "ot", 8], ["chunk", "ot", 4], ["split_block_k_nums", "ot", 2], ["vector_ws", "ot", 1], ["vector_as", "ot", 8], ["reorder_inner", "re", [0, 1]], ["AS_double_buffer", "ot", 1], ["WS_double_buffer", "ot", 0], ["auto_unroll_max_step", "ot", 1500]]}, "result": [[0.00013559134399375976], 0, 2.1820740699768066, 1638169574.02253], "version": 0.2, "tvm_version": "0.8.dev0"}
{"input": ["cuda -keys=cuda,gpu -max_num_threads=1024 -thread_warp_size=32", "conv2d_HWNCnc_tensorcore.cuda", [["TENSOR", [56, 56, 8, 64], "int4"], ["TENSOR", [3, 3, 64, 64], "int4"], 1, 1, 1, "int32"], {}], "config": {"index": 689070, "code_hash": null, "entity": [["block_row_warps", "ot", 1], ["block_col_warps", "ot", 2], ["warp_row_tiles", "ot", 8], ["warp_col_tiles", "ot", 4], ["chunk", "ot", 4], ["split_block_k_nums", "ot", 8], ["vector_ws", "ot", 8], ["vector_as", "ot", 1], ["reorder_inner", "re", [1, 0]], ["AS_double_buffer", "ot", 0], ["WS_double_buffer", "ot", 1], ["auto_unroll_max_step", "ot", 1500]]}, "result": [[0.0060657650625], 0, 5.016272783279419, 1638169579.1684203], "version": 0.2, "tvm_version": "0.8.dev0"}
{"input": ["cuda -keys=cuda,gpu -max_num_threads=1024 -thread_warp_size=32", "conv2d_HWNCnc_tensorcore.cuda", [["TENSOR", [56, 56, 8, 64], "int4"], ["TENSOR", [3, 3, 64, 64], "int4"], 1, 1, 1, "int32"], {}], "config": {"index": 514272, "code_hash": null, "entity": [["block_row_warps", "ot", 1], ["block_col_warps", "ot", 2], ["warp_row_tiles", "ot", 2], ["warp_col_tiles", "ot", 8], ["chunk", "ot", 2], ["split_block_k_nums", "ot", 2], ["vector_ws", "ot", 8], ["vector_as", "ot", 16], ["reorder_inner", "re", [1, 0]], ["AS_double_buffer", "ot", 1], ["WS_double_buffer", "ot", 1], ["auto_unroll_max_step", "ot", 512]]}, "result": [[0.0003918868442982456], 0, 2.3640358448028564, 1638169580.0393078], "version": 0.2, "tvm_version": "0.8.dev0"}
{"input": ["cuda -keys=cuda,gpu -max_num_threads=1024 -thread_warp_size=32", "conv2d_HWNCnc_tensorcore.cuda", [["TENSOR", [56, 56, 8, 64], "int4"], ["TENSOR", [3, 3, 64, 64], "int4"], 1, 1, 1, "int32"], {}], "config": {"index": 196719, "code_hash": null, "entity": [["block_row_warps", "ot", 1], ["block_col_warps", "ot", 4], ["warp_row_tiles", "ot", 4], ["warp_col_tiles", "ot", 2], ["chunk", "ot", 4], ["split_block_k_nums", "ot", 4], ["vector_ws", "ot", 1], ["vector_as", "ot", 1], ["reorder_inner", "re", [0, 1]], ["AS_double_buffer", "ot", 1], ["WS_double_buffer", "ot", 1], ["auto_unroll_max_step", "ot", 0]]}, "result": [[0.00017657595049504953], 0, 1.6857309341430664, 1638169580.9227712], "version": 0.2, "tvm_version": "0.8.dev0"}
{"input": ["cuda -keys=cuda,gpu -max_num_threads=1024 -thread_warp_size=32", "conv2d_HWNCnc_tensorcore.cuda", [["TENSOR", [56, 56, 8, 64], "int4"], ["TENSOR", [3, 3, 64, 64], "int4"], 1, 1, 1, "int32"], {}], "config": {"index": 757145, "code_hash": null, "entity": [["block_row_warps", "ot", 4], ["block_col_warps", "ot", 1], ["warp_row_tiles", "ot", 4], ["warp_col_tiles", "ot", 1], ["chunk", "ot", 2], ["split_block_k_nums", "ot", 2], ["vector_ws", "ot", 1], ["vector_as", "ot", 8], ["reorder_inner", "re", [1, 0]], ["AS_double_buffer", "ot", 1], ["WS_double_buffer", "ot", 1], ["auto_unroll_max_step", "ot", 1500]]}, "result": [[0.0003092722615101289], 0, 1.4191548824310303, 1638169581.7378666], "version": 0.2, "tvm_version": "0.8.dev0"}
{"input": ["cuda -keys=cuda,gpu -max_num_threads=1024 -thread_warp_size=32", "conv2d_HWNCnc_tensorcore.cuda", [["TENSOR", [56, 56, 8, 64], "int4"], ["TENSOR", [3, 3, 64, 64], "int4"], 1, 1, 1, "int32"], {}], "config": {"index": 410963, "code_hash": null, "entity": [["block_row_warps", "ot", 4], ["block_col_warps", "ot", 2], ["warp_row_tiles", "ot", 4], ["warp_col_tiles", "ot", 4], ["chunk", "ot", 4], ["split_block_k_nums", "ot", 1], ["vector_ws", "ot", 1], ["vector_as", "ot", 16], ["reorder_inner", "re", [0, 1]], ["AS_double_buffer", "ot", 0], ["WS_double_buffer", "ot", 1], ["auto_unroll_max_step", "ot", 512]]}, "result": [[0.0001870563451025057], 0, 1.58314847946167, 1638169582.5408337], "version": 0.2, "tvm_version": "0.8.dev0"}
{"input": ["cuda -keys=cuda,gpu -max_num_threads=1024 -thread_warp_size=32", "conv2d_HWNCnc_tensorcore.cuda", [["TENSOR", [56, 56, 8, 64], "int4"], ["TENSOR", [3, 3, 64, 64], "int4"], 1, 1, 1, "int32"], {}], "config": {"index": 559950, "code_hash": null, "entity": [["block_row_warps", "ot", 1], ["block_col_warps", "ot", 4], ["warp_row_tiles", "ot", 2], ["warp_col_tiles", "ot", 8], ["chunk", "ot", 1], ["split_block_k_nums", "ot", 16], ["vector_ws", "ot", 8], ["vector_as", "ot", 1], ["reorder_inner", "re", [1, 0]], ["AS_double_buffer", "ot", 0], ["WS_double_buffer", "ot", 0], ["auto_unroll_max_step", "ot", 1500]]}, "result": [[0.0008435331899441341], 0, 2.220435619354248, 1638169583.3723676], "version": 0.2, "tvm_version": "0.8.dev0"}
{"input": ["cuda -keys=cuda,gpu -max_num_threads=1024 -thread_warp_size=32", "conv2d_HWNCnc_tensorcore.cuda", [["TENSOR", [56, 56, 8, 64], "int4"], ["TENSOR", [3, 3, 64, 64], "int4"], 1, 1, 1, "int32"], {}], "config": {"index": 462077, "code_hash": null, "entity": [["block_row_warps", "ot", 4], ["block_col_warps", "ot", 4], ["warp_row_tiles", "ot", 2], ["warp_col_tiles", "ot", 8], ["chunk", "ot", 2], ["split_block_k_nums", "ot", 8], ["vector_ws", "ot", 8], ["vector_as", "ot", 1], ["reorder_inner", "re", [0, 1]], ["AS_double_buffer", "ot", 1], ["WS_double_buffer", "ot", 1], ["auto_unroll_max_step", "ot", 512]]}, "result": [[0.004405612628571428], 0, 2.9453539848327637, 1638169584.233703], "version": 0.2, "tvm_version": "0.8.dev0"}
{"input": ["cuda -keys=cuda,gpu -max_num_threads=1024 -thread_warp_size=32", "conv2d_HWNCnc_tensorcore.cuda", [["TENSOR", [56, 56, 8, 64], "int4"], ["TENSOR", [3, 3, 64, 64], "int4"], 1, 1, 1, "int32"], {}], "config": {"index": 752036, "code_hash": null, "entity": [["block_row_warps", "ot", 4], ["block_col_warps", "ot", 2], ["warp_row_tiles", "ot", 16], ["warp_col_tiles", "ot", 2], ["chunk", "ot", 4], ["split_block_k_nums", "ot", 2], ["vector_ws", "ot", 8], ["vector_as", "ot", 1], ["reorder_inner", "re", [1, 0]], ["AS_double_buffer", "ot", 1], ["WS_double_buffer", "ot", 1], ["auto_unroll_max_step", "ot", 1500]]}, "result": [[0.0008678870159574468], 0, 2.7841410636901855, 1638169585.051126], "version": 0.2, "tvm_version": "0.8.dev0"}
{"input": ["cuda -keys=cuda,gpu -max_num_threads=1024 -thread_warp_size=32", "conv2d_HWNCnc_tensorcore.cuda", [["TENSOR", [56, 56, 8, 64], "int4"], ["TENSOR", [3, 3, 64, 64], "int4"], 1, 1, 1, "int32"], {}], "config": {"index": 408160, "code_hash": null, "entity": [["block_row_warps", "ot", 2], ["block_col_warps", "ot", 1], ["warp_row_tiles", "ot", 2], ["warp_col_tiles", "ot", 1], ["chunk", "ot", 4], ["split_block_k_nums", "ot", 8], ["vector_ws", "ot", 8], ["vector_as", "ot", 8], ["reorder_inner", "re", [0, 1]], ["AS_double_buffer", "ot", 0], ["WS_double_buffer", "ot", 1], ["auto_unroll_max_step", "ot", 512]]}, "result": [[0.002374673711111111], 0, 2.2344260215759277, 1638169588.1725976], "version": 0.2, "tvm_version": "0.8.dev0"}
{"input": ["cuda -keys=cuda,gpu -max_num_threads=1024 -thread_warp_size=32", "conv2d_HWNCnc_tensorcore.cuda", [["TENSOR", [56, 56, 8, 64], "int4"], ["TENSOR", [3, 3, 64, 64], "int4"], 1, 1, 1, "int32"], {}], "config": {"index": 654544, "code_hash": null, "entity": [["block_row_warps", "ot", 2], ["block_col_warps", "ot", 1], ["warp_row_tiles", "ot", 4], ["warp_col_tiles", "ot", 1], ["chunk", "ot", 2], ["split_block_k_nums", "ot", 2], ["vector_ws", "ot", 8], ["vector_as", "ot", 1], ["reorder_inner", "re", [0, 1]], ["AS_double_buffer", "ot", 0], ["WS_double_buffer", "ot", 1], ["auto_unroll_max_step", "ot", 1500]]}, "result": [[0.001354048824], 0, 2.19187593460083, 1638169589.0410423], "version": 0.2, "tvm_version": "0.8.dev0"}
{"input": ["cuda -keys=cuda,gpu -max_num_threads=1024 -thread_warp_size=32", "conv2d_HWNCnc_tensorcore.cuda", [["TENSOR", [56, 56, 8, 64], "int4"], ["TENSOR", [3, 3, 64, 64], "int4"], 1, 1, 1, "int32"], {}], "config": {"index": 509751, "code_hash": null, "entity": [["block_row_warps", "ot", 1], ["block_col_warps", "ot", 1], ["warp_row_tiles", "ot", 16], ["warp_col_tiles", "ot", 4], ["chunk", "ot", 2], ["split_block_k_nums", "ot", 4], ["vector_ws", "ot", 1], ["vector_as", "ot", 16], ["reorder_inner", "re", [1, 0]], ["AS_double_buffer", "ot", 1], ["WS_double_buffer", "ot", 1], ["auto_unroll_max_step", "ot", 512]]}, "result": [[0.00010104198367346939], 0, 1.4915533065795898, 1638169589.864779], "version": 0.2, "tvm_version": "0.8.dev0"}
{"input": ["cuda -keys=cuda,gpu -max_num_threads=1024 -thread_warp_size=32", "conv2d_HWNCnc_tensorcore.cuda", [["TENSOR", [56, 56, 8, 64], "int4"], ["TENSOR", [3, 3, 64, 64], "int4"], 1, 1, 1, "int32"], {}], "config": {"index": 307651, "code_hash": null, "entity": [["block_row_warps", "ot", 2], ["block_col_warps", "ot", 2], ["warp_row_tiles", "ot", 8], ["warp_col_tiles", "ot", 2], ["chunk", "ot", 8], ["split_block_k_nums", "ot", 32], ["vector_ws", "ot", 1], ["vector_as", "ot", 8], ["reorder_inner", "re", [1, 0]], ["AS_double_buffer", "ot", 0], ["WS_double_buffer", "ot", 0], ["auto_unroll_max_step", "ot", 512]]}, "result": [[0.00020403003949579832], 0, 1.8794865608215332, 1638169591.094722], "version": 0.2, "tvm_version": "0.8.dev0"}
{"input": ["cuda -keys=cuda,gpu -max_num_threads=1024 -thread_warp_size=32", "conv2d_HWNCnc_tensorcore.cuda", [["TENSOR", [56, 56, 8, 64], "int4"], ["TENSOR", [3, 3, 64, 64], "int4"], 1, 1, 1, "int32"], {}], "config": {"index": 681986, "code_hash": null, "entity": [["block_row_warps", "ot", 4], ["block_col_warps", "ot", 1], ["warp_row_tiles", "ot", 2], ["warp_col_tiles", "ot", 1], ["chunk", "ot", 8], ["split_block_k_nums", "ot", 2], ["vector_ws", "ot", 1], ["vector_as", "ot", 1], ["reorder_inner", "re", [1, 0]], ["AS_double_buffer", "ot", 0], ["WS_double_buffer", "ot", 1], ["auto_unroll_max_step", "ot", 1500]]}, "result": [[0.0010157525], 0, 1.8896946907043457, 1638169591.9410987], "version": 0.2, "tvm_version": "0.8.dev0"}
{"input": ["cuda -keys=cuda,gpu -max_num_threads=1024 -thread_warp_size=32", "conv2d_HWNCnc_tensorcore.cuda", [["TENSOR", [56, 56, 8, 64], "int4"], ["TENSOR", [3, 3, 64, 64], "int4"], 1, 1, 1, "int32"], {}], "config": {"index": 245799, "code_hash": null, "entity": [["block_row_warps", "ot", 1], ["block_col_warps", "ot", 1], ["warp_row_tiles", "ot", 2], ["warp_col_tiles", "ot", 4], ["chunk", "ot", 1], ["split_block_k_nums", "ot", 8], ["vector_ws", "ot", 8], ["vector_as", "ot", 8], ["reorder_inner", "re", [1, 0]], ["AS_double_buffer", "ot", 1], ["WS_double_buffer", "ot", 1], ["auto_unroll_max_step", "ot", 0]]}, "result": [[0.00043008389598108744], 0, 1.3761074542999268, 1638169592.7964237], "version": 0.2, "tvm_version": "0.8.dev0"}
{"input": ["cuda -keys=cuda,gpu -max_num_threads=1024 -thread_warp_size=32", "conv2d_HWNCnc_tensorcore.cuda", [["TENSOR", [56, 56, 8, 64], "int4"], ["TENSOR", [3, 3, 64, 64], "int4"], 1, 1, 1, "int32"], {}], "config": {"index": 738626, "code_hash": null, "entity": [["block_row_warps", "ot", 4], ["block_col_warps", "ot", 2], ["warp_row_tiles", "ot", 16], ["warp_col_tiles", "ot", 8], ["chunk", "ot", 4], ["split_block_k_nums", "ot", 16], ["vector_ws", "ot", 1], ["vector_as", "ot", 16], ["reorder_inner", "re", [0, 1]], ["AS_double_buffer", "ot", 1], ["WS_double_buffer", "ot", 1], ["auto_unroll_max_step", "ot", 1500]]}, "result": [[0.0010570329790209792], 0, 2.5004618167877197, 1638169593.6240404], "version": 0.2, "tvm_version": "0.8.dev0"}
{"input": ["cuda -keys=cuda,gpu -max_num_threads=1024 -thread_warp_size=32", "conv2d_HWNCnc_tensorcore.cuda", [["TENSOR", [56, 56, 8, 64], "int4"], ["TENSOR", [3, 3, 64, 64], "int4"], 1, 1, 1, "int32"], {}], "config": {"index": 383572, "code_hash": null, "entity": [["block_row_warps", "ot", 2], ["block_col_warps", "ot", 1], ["warp_row_tiles", "ot", 16], ["warp_col_tiles", "ot", 8], ["chunk", "ot", 1], ["split_block_k_nums", "ot", 1], ["vector_ws", "ot", 8], ["vector_as", "ot", 16], ["reorder_inner", "re", [1, 0]], ["AS_double_buffer", "ot", 1], ["WS_double_buffer", "ot", 0], ["auto_unroll_max_step", "ot", 512]]}, "result": [[0.000409444232183908], 0, 1.939260482788086, 1638169594.469488], "version": 0.2, "tvm_version": "0.8.dev0"}
{"input": ["cuda -keys=cuda,gpu -max_num_threads=1024 -thread_warp_size=32", "conv2d_HWNCnc_tensorcore.cuda", [["TENSOR", [56, 56, 8, 64], "int4"], ["TENSOR", [3, 3, 64, 64], "int4"], 1, 1, 1, "int32"], {}], "config": {"index": 554543, "code_hash": null, "entity": [["block_row_warps", "ot", 4], ["block_col_warps", "ot", 4], ["warp_row_tiles", "ot", 1], ["warp_col_tiles", "ot", 8], ["chunk", "ot", 1], ["split_block_k_nums", "ot", 16], ["vector_ws", "ot", 1], ["vector_as", "ot", 1], ["reorder_inner", "re", [1, 0]], ["AS_double_buffer", "ot", 0], ["WS_double_buffer", "ot", 0], ["auto_unroll_max_step", "ot", 1500]]}, "result": [[0.0010882854214285715], 0, 3.2315187454223633, 1638169600.0084963], "version": 0.2, "tvm_version": "0.8.dev0"}
{"input": ["cuda -keys=cuda,gpu -max_num_threads=1024 -thread_warp_size=32", "conv2d_HWNCnc_tensorcore.cuda", [["TENSOR", [56, 56, 8, 64], "int4"], ["TENSOR", [3, 3, 64, 64], "int4"], 1, 1, 1, "int32"], {}], "config": {"index": 530936, "code_hash": null, "entity": [["block_row_warps", "ot", 4], ["block_col_warps", "ot", 4], ["warp_row_tiles", "ot", 4], ["warp_col_tiles", "ot", 8], ["chunk", "ot", 8], ["split_block_k_nums", "ot", 2], ["vector_ws", "ot", 1], ["vector_as", "ot", 8], ["reorder_inner", "re", [0, 1]], ["AS_double_buffer", "ot", 0], ["WS_double_buffer", "ot", 0], ["auto_unroll_max_step", "ot", 1500]]}, "result": [[0.0006451451706666666], 0, 2.681096315383911, 1638169601.2321663], "version": 0.2, "tvm_version": "0.8.dev0"}
{"input": ["cuda -keys=cuda,gpu -max_num_threads=1024 -thread_warp_size=32", "conv2d_HWNCnc_tensorcore.cuda", [["TENSOR", [56, 56, 8, 64], "int4"], ["TENSOR", [3, 3, 64, 64], "int4"], 1, 1, 1, "int32"], {}], "config": {"index": 743357, "code_hash": null, "entity": [["block_row_warps", "ot", 4], ["block_col_warps", "ot", 1], ["warp_row_tiles", "ot", 1], ["warp_col_tiles", "ot", 16], ["chunk", "ot", 8], ["split_block_k_nums", "ot", 8], ["vector_ws", "ot", 8], ["vector_as", "ot", 16], ["reorder_inner", "re", [0, 1]], ["AS_double_buffer", "ot", 1], ["WS_double_buffer", "ot", 1], ["auto_unroll_max_step", "ot", 1500]]}, "result": [[0.01056718185], 0, 5.329406499862671, 1638169602.2498267], "version": 0.2, "tvm_version": "0.8.dev0"}
{"input": ["cuda -keys=cuda,gpu -max_num_threads=1024 -thread_warp_size=32", "conv2d_HWNCnc_tensorcore.cuda", [["TENSOR", [56, 56, 8, 64], "int4"], ["TENSOR", [3, 3, 64, 64], "int4"], 1, 1, 1, "int32"], {}], "config": {"index": 285872, "code_hash": null, "entity": [["block_row_warps", "ot", 4], ["block_col_warps", "ot", 2], ["warp_row_tiles", "ot", 8], ["warp_col_tiles", "ot", 4], ["chunk", "ot", 4], ["split_block_k_nums", "ot", 32], ["vector_ws", "ot", 1], ["vector_as", "ot", 16], ["reorder_inner", "re", [0, 1]], ["AS_double_buffer", "ot", 0], ["WS_double_buffer", "ot", 0], ["auto_unroll_max_step", "ot", 512]]}, "result": [[0.001085085659192825], 0, 2.3769736289978027, 1638169603.6353767], "version": 0.2, "tvm_version": "0.8.dev0"}
{"input": ["cuda -keys=cuda,gpu -max_num_threads=1024 -thread_warp_size=32", "conv2d_HWNCnc_tensorcore.cuda", [["TENSOR", [56, 56, 8, 64], "int4"], ["TENSOR", [3, 3, 64, 64], "int4"], 1, 1, 1, "int32"], {}], "config": {"index": 607367, "code_hash": null, "entity": [["block_row_warps", "ot", 4], ["block_col_warps", "ot", 1], ["warp_row_tiles", "ot", 1], ["warp_col_tiles", "ot", 4], ["chunk", "ot", 8], ["split_block_k_nums", "ot", 4], ["vector_ws", "ot", 1], ["vector_as", "ot", 16], ["reorder_inner", "re", [0, 1]], ["AS_double_buffer", "ot", 1], ["WS_double_buffer", "ot", 0], ["auto_unroll_max_step", "ot", 1500]]}, "result": [[0.0002018582351543943], 0, 2.518974781036377, 1638169604.9380891], "version": 0.2, "tvm_version": "0.8.dev0"}
{"input": ["cuda -keys=cuda,gpu -max_num_threads=1024 -thread_warp_size=32", "conv2d_HWNCnc_tensorcore.cuda", [["TENSOR", [56, 56, 8, 64], "int4"], ["TENSOR", [3, 3, 64, 64], "int4"], 1, 1, 1, "int32"], {}], "config": {"index": 386921, "code_hash": null, "entity": [["block_row_warps", "ot", 4], ["block_col_warps", "ot", 1], ["warp_row_tiles", "ot", 2], ["warp_col_tiles", "ot", 8], ["chunk", "ot", 8], ["split_block_k_nums", "ot", 8], ["vector_ws", "ot", 8], ["vector_as", "ot", 16], ["reorder_inner", "re", [1, 0]], ["AS_double_buffer", "ot", 1], ["WS_double_buffer", "ot", 0], ["auto_unroll_max_step", "ot", 512]]}, "result": [[0.0004919823888888889], 0, 2.0384340286254883, 1638169605.9943728], "version": 0.2, "tvm_version": "0.8.dev0"}
{"input": ["cuda -keys=cuda,gpu -max_num_threads=1024 -thread_warp_size=32", "conv2d_HWNCnc_tensorcore.cuda", [["TENSOR", [56, 56, 8, 64], "int4"], ["TENSOR", [3, 3, 64, 64], "int4"], 1, 1, 1, "int32"], {}], "config": {"index": 266339, "code_hash": null, "entity": [["block_row_warps", "ot", 4], ["block_col_warps", "ot", 1], ["warp_row_tiles", "ot", 8], ["warp_col_tiles", "ot", 8], ["chunk", "ot", 8], ["split_block_k_nums", "ot", 2], ["vector_ws", "ot", 8], ["vector_as", "ot", 1], ["reorder_inner", "re", [0, 1]], ["AS_double_buffer", "ot", 0], ["WS_double_buffer", "ot", 0], ["auto_unroll_max_step", "ot", 512]]}, "result": [[0.001271794347457627], 0, 2.8963940143585205, 1638169607.2820132], "version": 0.2, "tvm_version": "0.8.dev0"}
{"input": ["cuda -keys=cuda,gpu -max_num_threads=1024 -thread_warp_size=32", "conv2d_HWNCnc_tensorcore.cuda", [["TENSOR", [56, 56, 8, 64], "int4"], ["TENSOR", [3, 3, 64, 64], "int4"], 1, 1, 1, "int32"], {}], "config": {"index": 270172, "code_hash": null, "entity": [["block_row_warps", "ot", 2], ["block_col_warps", "ot", 1], ["warp_row_tiles", "ot", 16], ["warp_col_tiles", "ot", 8], ["chunk", "ot", 1], ["split_block_k_nums", "ot", 1], ["vector_ws", "ot", 1], ["vector_as", "ot", 8], ["reorder_inner", "re", [0, 1]], ["AS_double_buffer", "ot", 0], ["WS_double_buffer", "ot", 0], ["auto_unroll_max_step", "ot", 512]]}, "result": [[0.00012795666296809986], 0, 1.8493168354034424, 1638169608.371659], "version": 0.2, "tvm_version": "0.8.dev0"}
{"input": ["cuda -keys=cuda,gpu -max_num_threads=1024 -thread_warp_size=32", "conv2d_HWNCnc_tensorcore.cuda", [["TENSOR", [56, 56, 8, 64], "int4"], ["TENSOR", [3, 3, 64, 64], "int4"], 1, 1, 1, "int32"], {}], "config": {"index": 134324, "code_hash": null, "entity": [["block_row_warps", "ot", 4], ["block_col_warps", "ot", 4], ["warp_row_tiles", "ot", 16], ["warp_col_tiles", "ot", 16], ["chunk", "ot", 1], ["split_block_k_nums", "ot", 32], ["vector_ws", "ot", 1], ["vector_as", "ot", 1], ["reorder_inner", "re", [0, 1]], ["AS_double_buffer", "ot", 0], ["WS_double_buffer", "ot", 1], ["auto_unroll_max_step", "ot", 0]]}, "result": [[0.0012556819679144385], 0, 2.247589111328125, 1638169620.0300457], "version": 0.2, "tvm_version": "0.8.dev0"}
{"input": ["cuda -keys=cuda,gpu -max_num_threads=1024 -thread_warp_size=32", "conv2d_HWNCnc_tensorcore.cuda", [["TENSOR", [56, 56, 8, 64], "int4"], ["TENSOR", [3, 3, 64, 64], "int4"], 1, 1, 1, "int32"], {}], "config": {"index": 774357, "code_hash": null, "entity": [["block_row_warps", "ot", 1], ["block_col_warps", "ot", 4], ["warp_row_tiles", "ot", 16], ["warp_col_tiles", "ot", 4], ["chunk", "ot", 2], ["split_block_k_nums", "ot", 4], ["vector_ws", "ot", 8], ["vector_as", "ot", 16], ["reorder_inner", "re", [1, 0]], ["AS_double_buffer", "ot", 1], ["WS_double_buffer", "ot", 1], ["auto_unroll_max_step", "ot", 1500]]}, "result": [[0.009204726549999999], 0, 4.916282653808594, 1638169622.0000093], "version": 0.2, "tvm_version": "0.8.dev0"}
{"input": ["cuda -keys=cuda,gpu -max_num_threads=1024 -thread_warp_size=32", "conv2d_HWNCnc_tensorcore.cuda", [["TENSOR", [56, 56, 8, 64], "int4"], ["TENSOR", [3, 3, 64, 64], "int4"], 1, 1, 1, "int32"], {}], "config": {"index": 95070, "code_hash": null, "entity": [["block_row_warps", "ot", 1], ["block_col_warps", "ot", 2], ["warp_row_tiles", "ot", 8], ["warp_col_tiles", "ot", 4], ["chunk", "ot", 4], ["split_block_k_nums", "ot", 8], ["vector_ws", "ot", 8], ["vector_as", "ot", 16], ["reorder_inner", "re", [0, 1]], ["AS_double_buffer", "ot", 1], ["WS_double_buffer", "ot", 0], ["auto_unroll_max_step", "ot", 0]]}, "result": [[0.000526451493902439], 0, 1.5743319988250732, 1638169622.9997492], "version": 0.2, "tvm_version": "0.8.dev0"}
{"input": ["cuda -keys=cuda,gpu -max_num_threads=1024 -thread_warp_size=32", "conv2d_HWNCnc_tensorcore.cuda", [["TENSOR", [56, 56, 8, 64], "int4"], ["TENSOR", [3, 3, 64, 64], "int4"], 1, 1, 1, "int32"], {}], "config": {"index": 55265, "code_hash": null, "entity": [["block_row_warps", "ot", 4], ["block_col_warps", "ot", 2], ["warp_row_tiles", "ot", 1], ["warp_col_tiles", "ot", 8], ["chunk", "ot", 2], ["split_block_k_nums", "ot", 2], ["vector_ws", "ot", 1], ["vector_as", "ot", 16], ["reorder_inner", "re", [1, 0]], ["AS_double_buffer", "ot", 0], ["WS_double_buffer", "ot", 0], ["auto_unroll_max_step", "ot", 0]]}, "result": [[0.00027873467125645433], 0, 1.4412589073181152, 1638169623.8578959], "version": 0.2, "tvm_version": "0.8.dev0"}
{"input": ["cuda -keys=cuda,gpu -max_num_threads=1024 -thread_warp_size=32", "conv2d_HWNCnc_tensorcore.cuda", [["TENSOR", [56, 56, 8, 64], "int4"], ["TENSOR", [3, 3, 64, 64], "int4"], 1, 1, 1, "int32"], {}], "config": {"index": 501416, "code_hash": null, "entity": [["block_row_warps", "ot", 4], ["block_col_warps", "ot", 4], ["warp_row_tiles", "ot", 4], ["warp_col_tiles", "ot", 4], ["chunk", "ot", 1], ["split_block_k_nums", "ot", 32], ["vector_ws", "ot", 1], ["vector_as", "ot", 8], ["reorder_inner", "re", [1, 0]], ["AS_double_buffer", "ot", 1], ["WS_double_buffer", "ot", 1], ["auto_unroll_max_step", "ot", 512]]}, "result": [[0.0013496210625], 0, 2.142120361328125, 1638169624.8569117], "version": 0.2, "tvm_version": "0.8.dev0"}
{"input": ["cuda -keys=cuda,gpu -max_num_threads=1024 -thread_warp_size=32", "conv2d_HWNCnc_tensorcore.cuda", [["TENSOR", [56, 56, 8, 64], "int4"], ["TENSOR", [3, 3, 64, 64], "int4"], 1, 1, 1, "int32"], {}], "config": {"index": 544643, "code_hash": null, "entity": [["block_row_warps", "ot", 4], ["block_col_warps", "ot", 4], ["warp_row_tiles", "ot", 1], ["warp_col_tiles", "ot", 8], ["chunk", "ot", 1], ["split_block_k_nums", "ot", 32], ["vector_ws", "ot", 1], ["vector_as", "ot", 16], ["reorder_inner", "re", [0, 1]], ["AS_double_buffer", "ot", 0], ["WS_double_buffer", "ot", 0], ["auto_unroll_max_step", "ot", 1500]]}, "result": [[0.0009606424968152866], 0, 2.8925564289093018, 1638169626.02098], "version": 0.2, "tvm_version": "0.8.dev0"}
{"input": ["cuda -keys=cuda,gpu -max_num_threads=1024 -thread_warp_size=32", "conv2d_HWNCnc_tensorcore.cuda", [["TENSOR", [56, 56, 8, 64], "int4"], ["TENSOR", [3, 3, 64, 64], "int4"], 1, 1, 1, "int32"], {}], "config": {"index": 274538, "code_hash": null, "entity": [["block_row_warps", "ot", 4], ["block_col_warps", "ot", 1], ["warp_row_tiles", "ot", 16], ["warp_col_tiles", "ot", 1], ["chunk", "ot", 1], ["split_block_k_nums", "ot", 32], ["vector_ws", "ot", 1], ["vector_as", "ot", 8], ["reorder_inner", "re", [0, 1]], ["AS_double_buffer", "ot", 0], ["WS_double_buffer", "ot", 0], ["auto_unroll_max_step", "ot", 512]]}, "result": [[0.00043321742165242165], 0, 1.4711685180664062, 1638169626.878152], "version": 0.2, "tvm_version": "0.8.dev0"}
{"input": ["cuda -keys=cuda,gpu -max_num_threads=1024 -thread_warp_size=32", "conv2d_HWNCnc_tensorcore.cuda", [["TENSOR", [56, 56, 8, 64], "int4"], ["TENSOR", [3, 3, 64, 64], "int4"], 1, 1, 1, "int32"], {}], "config": {"index": 639813, "code_hash": null, "entity": [["block_row_warps", "ot", 1], ["block_col_warps", "ot", 2], ["warp_row_tiles", "ot", 1], ["warp_col_tiles", "ot", 8], ["chunk", "ot", 8], ["split_block_k_nums", "ot", 4], ["vector_ws", "ot", 1], ["vector_as", "ot", 16], ["reorder_inner", "re", [1, 0]], ["AS_double_buffer", "ot", 1], ["WS_double_buffer", "ot", 0], ["auto_unroll_max_step", "ot", 1500]]}, "result": [[0.00011480045569620253], 0, 2.758270502090454, 1638169632.1910691], "version": 0.2, "tvm_version": "0.8.dev0"}
{"input": ["cuda -keys=cuda,gpu -max_num_threads=1024 -thread_warp_size=32", "conv2d_HWNCnc_tensorcore.cuda", [["TENSOR", [56, 56, 8, 64], "int4"], ["TENSOR", [3, 3, 64, 64], "int4"], 1, 1, 1, "int32"], {}], "config": {"index": 461376, "code_hash": null, "entity": [["block_row_warps", "ot", 1], ["block_col_warps", "ot", 1], ["warp_row_tiles", "ot", 16], ["warp_col_tiles", "ot", 4], ["chunk", "ot", 4], ["split_block_k_nums", "ot", 4], ["vector_ws", "ot", 8], ["vector_as", "ot", 1], ["reorder_inner", "re", [0, 1]], ["AS_double_buffer", "ot", 1], ["WS_double_buffer", "ot", 1], ["auto_unroll_max_step", "ot", 512]]}, "result": [[0.0005127479534883722], 0, 2.503861665725708, 1638169633.4310749], "version": 0.2, "tvm_version": "0.8.dev0"}
{"input": ["cuda -keys=cuda,gpu -max_num_threads=1024 -thread_warp_size=32", "conv2d_HWNCnc_tensorcore.cuda", [["TENSOR", [56, 56, 8, 64], "int4"], ["TENSOR", [3, 3, 64, 64], "int4"], 1, 1, 1, "int32"], {}], "config": {"index": 643915, "code_hash": null, "entity": [["block_row_warps", "ot", 2], ["block_col_warps", "ot", 1], ["warp_row_tiles", "ot", 2], ["warp_col_tiles", "ot", 16], ["chunk", "ot", 2], ["split_block_k_nums", "ot", 2], ["vector_ws", "ot", 8], ["vector_as", "ot", 16], ["reorder_inner", "re", [1, 0]], ["AS_double_buffer", "ot", 1], ["WS_double_buffer", "ot", 0], ["auto_unroll_max_step", "ot", 1500]]}, "result": [[0.01028164315], 0, 5.948805809020996, 1638169635.5233123], "version": 0.2, "tvm_version": "0.8.dev0"}
{"input": ["cuda -keys=cuda,gpu -max_num_threads=1024 -thread_warp_size=32", "conv2d_HWNCnc_tensorcore.cuda", [["TENSOR", [56, 56, 8, 64], "int4"], ["TENSOR", [3, 3, 64, 64], "int4"], 1, 1, 1, "int32"], {}], "config": {"index": 336698, "code_hash": null, "entity": [["block_row_warps", "ot", 4], ["block_col_warps", "ot", 4], ["warp_row_tiles", "ot", 1], ["warp_col_tiles", "ot", 4], ["chunk", "ot", 1], ["split_block_k_nums", "ot", 4], ["vector_ws", "ot", 1], ["vector_as", "ot", 8], ["reorder_inner", "re", [0, 1]], ["AS_double_buffer", "ot", 1], ["WS_double_buffer", "ot", 0], ["auto_unroll_max_step", "ot", 512]]}, "result": [[0.002870506320754717], 0, 2.479461669921875, 1638169636.6227264], "version": 0.2, "tvm_version": "0.8.dev0"}
{"input": ["cuda -keys=cuda,gpu -max_num_threads=1024 -thread_warp_size=32", "conv2d_HWNCnc_tensorcore.cuda", [["TENSOR", [56, 56, 8, 64], "int4"], ["TENSOR", [3, 3, 64, 64], "int4"], 1, 1, 1, "int32"], {}], "config": {"index": 140682, "code_hash": null, "entity": [["block_row_warps", "ot", 1], ["block_col_warps", "ot", 2], ["warp_row_tiles", "ot", 2], ["warp_col_tiles", "ot", 2], ["chunk", "ot", 2], ["split_block_k_nums", "ot", 1], ["vector_ws", "ot", 1], ["vector_as", "ot", 8], ["reorder_inner", "re", [0, 1]], ["AS_double_buffer", "ot", 0], ["WS_double_buffer", "ot", 1], ["auto_unroll_max_step", "ot", 0]]}, "result": [[0.00012903051287553648], 0, 1.525892972946167, 1638169637.5419545], "version": 0.2, "tvm_version": "0.8.dev0"}
{"input": ["cuda -keys=cuda,gpu -max_num_threads=1024 -thread_warp_size=32", "conv2d_HWNCnc_tensorcore.cuda", [["TENSOR", [56, 56, 8, 64], "int4"], ["TENSOR", [3, 3, 64, 64], "int4"], 1, 1, 1, "int32"], {}], "config": {"index": 126742, "code_hash": null, "entity": [["block_row_warps", "ot", 2], ["block_col_warps", "ot", 2], ["warp_row_tiles", "ot", 4], ["warp_col_tiles", "ot", 2], ["chunk", "ot", 8], ["split_block_k_nums", "ot", 4], ["vector_ws", "ot", 8], ["vector_as", "ot", 16], ["reorder_inner", "re", [1, 0]], ["AS_double_buffer", "ot", 1], ["WS_double_buffer", "ot", 0], ["auto_unroll_max_step", "ot", 0]]}, "result": [[0.0004809996289473684], 0, 1.5316410064697266, 1638169638.4523737], "version": 0.2, "tvm_version": "0.8.dev0"}
{"input": ["cuda -keys=cuda,gpu -max_num_threads=1024 -thread_warp_size=32", "conv2d_HWNCnc_tensorcore.cuda", [["TENSOR", [56, 56, 8, 64], "int4"], ["TENSOR", [3, 3, 64, 64], "int4"], 1, 1, 1, "int32"], {}], "config": {"index": 210637, "code_hash": null, "entity": [["block_row_warps", "ot", 2], ["block_col_warps", "ot", 1], ["warp_row_tiles", "ot", 16], ["warp_col_tiles", "ot", 1], ["chunk", "ot", 1], ["split_block_k_nums", "ot", 1], ["vector_ws", "ot", 8], ["vector_as", "ot", 8], ["reorder_inner", "re", [0, 1]], ["AS_double_buffer", "ot", 1], ["WS_double_buffer", "ot", 1], ["auto_unroll_max_step", "ot", 0]]}, "result": [[0.000552065094224924], 0, 1.5316250324249268, 1638169639.3993096], "version": 0.2, "tvm_version": "0.8.dev0"}
{"input": ["cuda -keys=cuda,gpu -max_num_threads=1024 -thread_warp_size=32", "conv2d_HWNCnc_tensorcore.cuda", [["TENSOR", [56, 56, 8, 64], "int4"], ["TENSOR", [3, 3, 64, 64], "int4"], 1, 1, 1, "int32"], {}], "config": {"index": 23012, "code_hash": null, "entity": [["block_row_warps", "ot", 4], ["block_col_warps", "ot", 4], ["warp_row_tiles", "ot", 2], ["warp_col_tiles", "ot", 2], ["chunk", "ot", 4], ["split_block_k_nums", "ot", 2], ["vector_ws", "ot", 1], ["vector_as", "ot", 16], ["reorder_inner", "re", [0, 1]], ["AS_double_buffer", "ot", 0], ["WS_double_buffer", "ot", 0], ["auto_unroll_max_step", "ot", 0]]}, "result": [[0.000305169894], 0, 1.3175618648529053, 1638169640.233938], "version": 0.2, "tvm_version": "0.8.dev0"}
{"input": ["cuda -keys=cuda,gpu -max_num_threads=1024 -thread_warp_size=32", "conv2d_HWNCnc_tensorcore.cuda", [["TENSOR", [56, 56, 8, 64], "int4"], ["TENSOR", [3, 3, 64, 64], "int4"], 1, 1, 1, "int32"], {}], "config": {"index": 351211, "code_hash": null, "entity": [["block_row_warps", "ot", 2], ["block_col_warps", "ot", 2], ["warp_row_tiles", "ot", 8], ["warp_col_tiles", "ot", 16], ["chunk", "ot", 1], ["split_block_k_nums", "ot", 1], ["vector_ws", "ot", 8], ["vector_as", "ot", 16], ["reorder_inner", "re", [0, 1]], ["AS_double_buffer", "ot", 1], ["WS_double_buffer", "ot", 0], ["auto_unroll_max_step", "ot", 512]]}, "result": [[0.0007093631312217194], 0, 2.471560478210449, 1638169648.712176], "version": 0.2, "tvm_version": "0.8.dev0"}
{"input": ["cuda -keys=cuda,gpu -max_num_threads=1024 -thread_warp_size=32", "conv2d_HWNCnc_tensorcore.cuda", [["TENSOR", [56, 56, 8, 64], "int4"], ["TENSOR", [3, 3, 64, 64], "int4"], 1, 1, 1, "int32"], {}], "config": {"index": 577947, "code_hash": null, "entity": [["block_row_warps", "ot", 1], ["block_col_warps", "ot", 2], ["warp_row_tiles", "ot", 2], ["warp_col_tiles", "ot", 8], ["chunk", "ot", 1], ["split_block_k_nums", "ot", 1], ["vector_ws", "ot", 8], ["vector_as", "ot", 16], ["reorder_inner", "re", [1, 0]], ["AS_double_buffer", "ot", 0], ["WS_double_buffer", "ot", 0], ["auto_unroll_max_step", "ot", 1500]]}, "result": [[0.0005266893343465045], 0, 4.19637131690979, 1638169650.5056093], "version": 0.2, "tvm_version": "0.8.dev0"}
{"input": ["cuda -keys=cuda,gpu -max_num_threads=1024 -thread_warp_size=32", "conv2d_HWNCnc_tensorcore.cuda", [["TENSOR", [56, 56, 8, 64], "int4"], ["TENSOR", [3, 3, 64, 64], "int4"], 1, 1, 1, "int32"], {}], "config": {"index": 337661, "code_hash": null, "entity": [["block_row_warps", "ot", 4], ["block_col_warps", "ot", 4], ["warp_row_tiles", "ot", 4], ["warp_col_tiles", "ot", 8], ["chunk", "ot", 1], ["split_block_k_nums", "ot", 8], ["vector_ws", "ot", 1], ["vector_as", "ot", 8], ["reorder_inner", "re", [0, 1]], ["AS_double_buffer", "ot", 1], ["WS_double_buffer", "ot", 0], ["auto_unroll_max_step", "ot", 512]]}, "result": [[0.0007088432196261683], 0, 3.1301774978637695, 1638169651.6325953], "version": 0.2, "tvm_version": "0.8.dev0"}
{"input": ["cuda -keys=cuda,gpu -max_num_threads=1024 -thread_warp_size=32", "conv2d_HWNCnc_tensorcore.cuda", [["TENSOR", [56, 56, 8, 64], "int4"], ["TENSOR", [3, 3, 64, 64], "int4"], 1, 1, 1, "int32"], {}], "config": {"index": 188396, "code_hash": null, "entity": [["block_row_warps", "ot", 4], ["block_col_warps", "ot", 4], ["warp_row_tiles", "ot", 4], ["warp_col_tiles", "ot", 2], ["chunk", "ot", 2], ["split_block_k_nums", "ot", 32], ["vector_ws", "ot", 1], ["vector_as", "ot", 16], ["reorder_inner", "re", [1, 0]], ["AS_double_buffer", "ot", 0], ["WS_double_buffer", "ot", 1], ["auto_unroll_max_step", "ot", 0]]}, "result": [[0.000291372578820698], 0, 1.7817304134368896, 1638169652.891179], "version": 0.2, "tvm_version": "0.8.dev0"}
{"input": ["cuda -keys=cuda,gpu -max_num_threads=1024 -thread_warp_size=32", "conv2d_HWNCnc_tensorcore.cuda", [["TENSOR", [56, 56, 8, 64], "int4"], ["TENSOR", [3, 3, 64, 64], "int4"], 1, 1, 1, "int32"], {}], "config": {"index": 293022, "code_hash": null, "entity": [["block_row_warps", "ot", 1], ["block_col_warps", "ot", 1], ["warp_row_tiles", "ot", 8], ["warp_col_tiles", "ot", 2], ["chunk", "ot", 4], ["split_block_k_nums", "ot", 2], ["vector_ws", "ot", 1], ["vector_as", "ot", 1], ["reorder_inner", "re", [1, 0]], ["AS_double_buffer", "ot", 0], ["WS_double_buffer", "ot", 0], ["auto_unroll_max_step", "ot", 512]]}, "result": [[0.00034077088976377953], 0, 2.006243944168091, 1638169654.0094526], "version": 0.2, "tvm_version": "0.8.dev0"}
{"input": ["cuda -keys=cuda,gpu -max_num_threads=1024 -thread_warp_size=32", "conv2d_HWNCnc_tensorcore.cuda", [["TENSOR", [56, 56, 8, 64], "int4"], ["TENSOR", [3, 3, 64, 64], "int4"], 1, 1, 1, "int32"], {}], "config": {"index": 191668, "code_hash": null, "entity": [["block_row_warps", "ot", 2], ["block_col_warps", "ot", 2], ["warp_row_tiles", "ot", 2], ["warp_col_tiles", "ot", 16], ["chunk", "ot", 8], ["split_block_k_nums", "ot", 4], ["vector_ws", "ot", 8], ["vector_as", "ot", 16], ["reorder_inner", "re", [1, 0]], ["AS_double_buffer", "ot", 0], ["WS_double_buffer", "ot", 1], ["auto_unroll_max_step", "ot", 0]]}, "result": [[0.0005555745696202532], 0, 1.511430025100708, 1638169654.932958], "version": 0.2, "tvm_version": "0.8.dev0"}
{"input": ["cuda -keys=cuda,gpu -max_num_threads=1024 -thread_warp_size=32", "conv2d_HWNCnc_tensorcore.cuda", [["TENSOR", [56, 56, 8, 64], "int4"], ["TENSOR", [3, 3, 64, 64], "int4"], 1, 1, 1, "int32"], {}], "config": {"index": 673133, "code_hash": null, "entity": [["block_row_warps", "ot", 4], ["block_col_warps", "ot", 2], ["warp_row_tiles", "ot", 4], ["warp_col_tiles", "ot", 8], ["chunk", "ot", 8], ["split_block_k_nums", "ot", 8], ["vector_ws", "ot", 1], ["vector_as", "ot", 16], ["reorder_inner", "re", [0, 1]], ["AS_double_buffer", "ot", 0], ["WS_double_buffer", "ot", 1], ["auto_unroll_max_step", "ot", 1500]]}, "result": [[0.0010709016971830985], 0, 2.9276599884033203, 1638169660.561524], "version": 0.2, "tvm_version": "0.8.dev0"}
{"input": ["cuda -keys=cuda,gpu -max_num_threads=1024 -thread_warp_size=32", "conv2d_HWNCnc_tensorcore.cuda", [["TENSOR", [56, 56, 8, 64], "int4"], ["TENSOR", [3, 3, 64, 64], "int4"], 1, 1, 1, "int32"], {}], "config": {"index": 23691, "code_hash": null, "entity": [["block_row_warps", "ot", 1], ["block_col_warps", "ot", 2], ["warp_row_tiles", "ot", 4], ["warp_col_tiles", "ot", 2], ["chunk", "ot", 2], ["split_block_k_nums", "ot", 4], ["vector_ws", "ot", 1], ["vector_as", "ot", 16], ["reorder_inner", "re", [0, 1]], ["AS_double_buffer", "ot", 0], ["WS_double_buffer", "ot", 0], ["auto_unroll_max_step", "ot", 0]]}, "result": [[0.00013233491833704528], 0, 1.7182178497314453, 1638169886.246055], "version": 0.2, "tvm_version": "0.8.dev0"}
{"input": ["cuda -keys=cuda,gpu -max_num_threads=1024 -thread_warp_size=32", "conv2d_HWNCnc_tensorcore.cuda", [["TENSOR", [56, 56, 8, 64], "int4"], ["TENSOR", [3, 3, 64, 64], "int4"], 1, 1, 1, "int32"], {}], "config": {"index": 153291, "code_hash": null, "entity": [["block_row_warps", "ot", 1], ["block_col_warps", "ot", 2], ["warp_row_tiles", "ot", 4], ["warp_col_tiles", "ot", 2], ["chunk", "ot", 2], ["split_block_k_nums", "ot", 4], ["vector_ws", "ot", 1], ["vector_as", "ot", 16], ["reorder_inner", "re", [0, 1]], ["AS_double_buffer", "ot", 0], ["WS_double_buffer", "ot", 1], ["auto_unroll_max_step", "ot", 0]]}, "result": [[0.00013193421891685735], 0, 1.3955168724060059, 1638169887.0898762], "version": 0.2, "tvm_version": "0.8.dev0"}
{"input": ["cuda -keys=cuda,gpu -max_num_threads=1024 -thread_warp_size=32", "conv2d_HWNCnc_tensorcore.cuda", [["TENSOR", [56, 56, 8, 64], "int4"], ["TENSOR", [3, 3, 64, 64], "int4"], 1, 1, 1, "int32"], {}], "config": {"index": 12891, "code_hash": null, "entity": [["block_row_warps", "ot", 1], ["block_col_warps", "ot", 2], ["warp_row_tiles", "ot", 4], ["warp_col_tiles", "ot", 2], ["chunk", "ot", 2], ["split_block_k_nums", "ot", 4], ["vector_ws", "ot", 1], ["vector_as", "ot", 8], ["reorder_inner", "re", [0, 1]], ["AS_double_buffer", "ot", 0], ["WS_double_buffer", "ot", 0], ["auto_unroll_max_step", "ot", 0]]}, "result": [[0.00013186216195569138], 0, 1.4300727844238281, 1638169887.95658], "version": 0.2, "tvm_version": "0.8.dev0"}
{"input": ["cuda -keys=cuda,gpu -max_num_threads=1024 -thread_warp_size=32", "conv2d_HWNCnc_tensorcore.cuda", [["TENSOR", [56, 56, 8, 64], "int4"], ["TENSOR", [3, 3, 64, 64], "int4"], 1, 1, 1, "int32"], {}], "config": {"index": 121428, "code_hash": null, "entity": [["block_row_warps", "ot", 1], ["block_col_warps", "ot", 1], ["warp_row_tiles", "ot", 4], ["warp_col_tiles", "ot", 8], ["chunk", "ot", 8], ["split_block_k_nums", "ot", 4], ["vector_ws", "ot", 1], ["vector_as", "ot", 16], ["reorder_inner", "re", [1, 0]], ["AS_double_buffer", "ot", 1], ["WS_double_buffer", "ot", 0], ["auto_unroll_max_step", "ot", 0]]}, "result": [[9.487156464379946e-05], 0, 1.443382740020752, 1638169888.856875], "version": 0.2, "tvm_version": "0.8.dev0"}
{"input": ["cuda -keys=cuda,gpu -max_num_threads=1024 -thread_warp_size=32", "conv2d_HWNCnc_tensorcore.cuda", [["TENSOR", [56, 56, 8, 64], "int4"], ["TENSOR", [3, 3, 64, 64], "int4"], 1, 1, 1, "int32"], {}], "config": {"index": 121419, "code_hash": null, "entity": [["block_row_warps", "ot", 1], ["block_col_warps", "ot", 1], ["warp_row_tiles", "ot", 2], ["warp_col_tiles", "ot", 8], ["chunk", "ot", 8], ["split_block_k_nums", "ot", 4], ["vector_ws", "ot", 1], ["vector_as", "ot", 16], ["reorder_inner", "re", [1, 0]], ["AS_double_buffer", "ot", 1], ["WS_double_buffer", "ot", 0], ["auto_unroll_max_step", "ot", 0]]}, "result": [[9.486089438576988e-05], 0, 1.364915132522583, 1638169889.6727757], "version": 0.2, "tvm_version": "0.8.dev0"}
{"input": ["cuda -keys=cuda,gpu -max_num_threads=1024 -thread_warp_size=32", "conv2d_HWNCnc_tensorcore.cuda", [["TENSOR", [56, 56, 8, 64], "int4"], ["TENSOR", [3, 3, 64, 64], "int4"], 1, 1, 1, "int32"], {}], "config": {"index": 142491, "code_hash": null, "entity": [["block_row_warps", "ot", 1], ["block_col_warps", "ot", 2], ["warp_row_tiles", "ot", 4], ["warp_col_tiles", "ot", 2], ["chunk", "ot", 2], ["split_block_k_nums", "ot", 4], ["vector_ws", "ot", 1], ["vector_as", "ot", 8], ["reorder_inner", "re", [0, 1]], ["AS_double_buffer", "ot", 0], ["WS_double_buffer", "ot", 1], ["auto_unroll_max_step", "ot", 0]]}, "result": [[0.00013190615225707727], 0, 1.4275355339050293, 1638169890.5365286], "version": 0.2, "tvm_version": "0.8.dev0"}
{"input": ["cuda -keys=cuda,gpu -max_num_threads=1024 -thread_warp_size=32", "conv2d_HWNCnc_tensorcore.cuda", [["TENSOR", [56, 56, 8, 64], "int4"], ["TENSOR", [3, 3, 64, 64], "int4"], 1, 1, 1, "int32"], {}], "config": {"index": 110628, "code_hash": null, "entity": [["block_row_warps", "ot", 1], ["block_col_warps", "ot", 1], ["warp_row_tiles", "ot", 4], ["warp_col_tiles", "ot", 8], ["chunk", "ot", 8], ["split_block_k_nums", "ot", 4], ["vector_ws", "ot", 1], ["vector_as", "ot", 8], ["reorder_inner", "re", [1, 0]], ["AS_double_buffer", "ot", 1], ["WS_double_buffer", "ot", 0], ["auto_unroll_max_step", "ot", 0]]}, "result": [[9.489879533404031e-05], 0, 1.3884048461914062, 1638169891.382466], "version": 0.2, "tvm_version": "0.8.dev0"}
{"input": ["cuda -keys=cuda,gpu -max_num_threads=1024 -thread_warp_size=32", "conv2d_HWNCnc_tensorcore.cuda", [["TENSOR", [56, 56, 8, 64], "int4"], ["TENSOR", [3, 3, 64, 64], "int4"], 1, 1, 1, "int32"], {}], "config": {"index": 121203, "code_hash": null, "entity": [["block_row_warps", "ot", 1], ["block_col_warps", "ot", 1], ["warp_row_tiles", "ot", 4], ["warp_col_tiles", "ot", 8], ["chunk", "ot", 4], ["split_block_k_nums", "ot", 4], ["vector_ws", "ot", 1], ["vector_as", "ot", 16], ["reorder_inner", "re", [1, 0]], ["AS_double_buffer", "ot", 1], ["WS_double_buffer", "ot", 0], ["auto_unroll_max_step", "ot", 0]]}, "result": [[9.485399203821657e-05], 0, 1.39052414894104, 1638169892.2297893], "version": 0.2, "tvm_version": "0.8.dev0"}
{"input": ["cuda -keys=cuda,gpu -max_num_threads=1024 -thread_warp_size=32", "conv2d_HWNCnc_tensorcore.cuda", [["TENSOR", [56, 56, 8, 64], "int4"], ["TENSOR", [3, 3, 64, 64], "int4"], 1, 1, 1, "int32"], {}], "config": {"index": 88533, "code_hash": null, "entity": [["block_row_warps", "ot", 1], ["block_col_warps", "ot", 1], ["warp_row_tiles", "ot", 4], ["warp_col_tiles", "ot", 4], ["chunk", "ot", 2], ["split_block_k_nums", "ot", 4], ["vector_ws", "ot", 1], ["vector_as", "ot", 16], ["reorder_inner", "re", [0, 1]], ["AS_double_buffer", "ot", 1], ["WS_double_buffer", "ot", 0], ["auto_unroll_max_step", "ot", 0]]}, "result": [[0.00011805214692256782], 0, 1.4282512664794922, 1638169893.8031495], "version": 0.2, "tvm_version": "0.8.dev0"}
{"input": ["cuda -keys=cuda,gpu -max_num_threads=1024 -thread_warp_size=32", "conv2d_HWNCnc_tensorcore.cuda", [["TENSOR", [56, 56, 8, 64], "int4"], ["TENSOR", [3, 3, 64, 64], "int4"], 1, 1, 1, "int32"], {}], "config": {"index": 119628, "code_hash": null, "entity": [["block_row_warps", "ot", 1], ["block_col_warps", "ot", 1], ["warp_row_tiles", "ot", 4], ["warp_col_tiles", "ot", 8], ["chunk", "ot", 8], ["split_block_k_nums", "ot", 1], ["vector_ws", "ot", 1], ["vector_as", "ot", 16], ["reorder_inner", "re", [1, 0]], ["AS_double_buffer", "ot", 1], ["WS_double_buffer", "ot", 0], ["auto_unroll_max_step", "ot", 0]]}, "result": [[9.301087941473261e-05], 0, 1.4318947792053223, 1638169894.713057], "version": 0.2, "tvm_version": "0.8.dev0"}
{"input": ["cuda -keys=cuda,gpu -max_num_threads=1024 -thread_warp_size=32", "conv2d_HWNCnc_tensorcore.cuda", [["TENSOR", [56, 56, 8, 64], "int4"], ["TENSOR", [3, 3, 64, 64], "int4"], 1, 1, 1, "int32"], {}], "config": {"index": 23673, "code_hash": null, "entity": [["block_row_warps", "ot", 1], ["block_col_warps", "ot", 2], ["warp_row_tiles", "ot", 1], ["warp_col_tiles", "ot", 2], ["chunk", "ot", 2], ["split_block_k_nums", "ot", 4], ["vector_ws", "ot", 1], ["vector_as", "ot", 16], ["reorder_inner", "re", [0, 1]], ["AS_double_buffer", "ot", 0], ["WS_double_buffer", "ot", 0], ["auto_unroll_max_step", "ot", 0]]}, "result": [[0.0001320871493108729], 0, 1.370866060256958, 1638169895.5386398], "version": 0.2, "tvm_version": "0.8.dev0"}
{"input": ["cuda -keys=cuda,gpu -max_num_threads=1024 -thread_warp_size=32", "conv2d_HWNCnc_tensorcore.cuda", [["TENSOR", [56, 56, 8, 64], "int4"], ["TENSOR", [3, 3, 64, 64], "int4"], 1, 1, 1, "int32"], {}], "config": {"index": 23682, "code_hash": null, "entity": [["block_row_warps", "ot", 1], ["block_col_warps", "ot", 2], ["warp_row_tiles", "ot", 2], ["warp_col_tiles", "ot", 2], ["chunk", "ot", 2], ["split_block_k_nums", "ot", 4], ["vector_ws", "ot", 1], ["vector_as", "ot", 16], ["reorder_inner", "re", [0, 1]], ["AS_double_buffer", "ot", 0], ["WS_double_buffer", "ot", 0], ["auto_unroll_max_step", "ot", 0]]}, "result": [[0.0001316855137825421], 0, 1.4135313034057617, 1638169896.4044788], "version": 0.2, "tvm_version": "0.8.dev0"}
{"input": ["cuda -keys=cuda,gpu -max_num_threads=1024 -thread_warp_size=32", "conv2d_HWNCnc_tensorcore.cuda", [["TENSOR", [56, 56, 8, 64], "int4"], ["TENSOR", [3, 3, 64, 64], "int4"], 1, 1, 1, "int32"], {}], "config": {"index": 110619, "code_hash": null, "entity": [["block_row_warps", "ot", 1], ["block_col_warps", "ot", 1], ["warp_row_tiles", "ot", 2], ["warp_col_tiles", "ot", 8], ["chunk", "ot", 8], ["split_block_k_nums", "ot", 4], ["vector_ws", "ot", 1], ["vector_as", "ot", 8], ["reorder_inner", "re", [1, 0]], ["AS_double_buffer", "ot", 1], ["WS_double_buffer", "ot", 0], ["auto_unroll_max_step", "ot", 0]]}, "result": [[9.481366542948037e-05], 0, 1.3800404071807861, 1638169897.2458994], "version": 0.2, "tvm_version": "0.8.dev0"}
{"input": ["cuda -keys=cuda,gpu -max_num_threads=1024 -thread_warp_size=32", "conv2d_HWNCnc_tensorcore.cuda", [["TENSOR", [56, 56, 8, 64], "int4"], ["TENSOR", [3, 3, 64, 64], "int4"], 1, 1, 1, "int32"], {}], "config": {"index": 121194, "code_hash": null, "entity": [["block_row_warps", "ot", 1], ["block_col_warps", "ot", 1], ["warp_row_tiles", "ot", 2], ["warp_col_tiles", "ot", 8], ["chunk", "ot", 4], ["split_block_k_nums", "ot", 4], ["vector_ws", "ot", 1], ["vector_as", "ot", 16], ["reorder_inner", "re", [1, 0]], ["AS_double_buffer", "ot", 1], ["WS_double_buffer", "ot", 0], ["auto_unroll_max_step", "ot", 0]]}, "result": [[9.512207101218866e-05], 0, 1.3836934566497803, 1638169898.097744], "version": 0.2, "tvm_version": "0.8.dev0"}
{"input": ["cuda -keys=cuda,gpu -max_num_threads=1024 -thread_warp_size=32", "conv2d_HWNCnc_tensorcore.cuda", [["TENSOR", [56, 56, 8, 64], "int4"], ["TENSOR", [3, 3, 64, 64], "int4"], 1, 1, 1, "int32"], {}], "config": {"index": 23733, "code_hash": null, "entity": [["block_row_warps", "ot", 1], ["block_col_warps", "ot", 1], ["warp_row_tiles", "ot", 4], ["warp_col_tiles", "ot", 4], ["chunk", "ot", 2], ["split_block_k_nums", "ot", 4], ["vector_ws", "ot", 1], ["vector_as", "ot", 16], ["reorder_inner", "re", [0, 1]], ["AS_double_buffer", "ot", 0], ["WS_double_buffer", "ot", 0], ["auto_unroll_max_step", "ot", 0]]}, "result": [[0.00011834948531375167], 0, 1.4131836891174316, 1638169898.976245], "version": 0.2, "tvm_version": "0.8.dev0"}
{"input": ["cuda -keys=cuda,gpu -max_num_threads=1024 -thread_warp_size=32", "conv2d_HWNCnc_tensorcore.cuda", [["TENSOR", [56, 56, 8, 64], "int4"], ["TENSOR", [3, 3, 64, 64], "int4"], 1, 1, 1, "int32"], {}], "config": {"index": 249228, "code_hash": null, "entity": [["block_row_warps", "ot", 1], ["block_col_warps", "ot", 1], ["warp_row_tiles", "ot", 4], ["warp_col_tiles", "ot", 8], ["chunk", "ot", 8], ["split_block_k_nums", "ot", 1], ["vector_ws", "ot", 1], ["vector_as", "ot", 16], ["reorder_inner", "re", [1, 0]], ["AS_double_buffer", "ot", 1], ["WS_double_buffer", "ot", 1], ["auto_unroll_max_step", "ot", 0]]}, "result": [[9.299154735234217e-05], 0, 1.3766050338745117, 1638169899.8289135], "version": 0.2, "tvm_version": "0.8.dev0"}
{"input": ["cuda -keys=cuda,gpu -max_num_threads=1024 -thread_warp_size=32", "conv2d_HWNCnc_tensorcore.cuda", [["TENSOR", [56, 56, 8, 64], "int4"], ["TENSOR", [3, 3, 64, 64], "int4"], 1, 1, 1, "int32"], {}], "config": {"index": 121410, "code_hash": null, "entity": [["block_row_warps", "ot", 1], ["block_col_warps", "ot", 1], ["warp_row_tiles", "ot", 1], ["warp_col_tiles", "ot", 8], ["chunk", "ot", 8], ["split_block_k_nums", "ot", 4], ["vector_ws", "ot", 1], ["vector_as", "ot", 16], ["reorder_inner", "re", [1, 0]], ["AS_double_buffer", "ot", 1], ["WS_double_buffer", "ot", 0], ["auto_unroll_max_step", "ot", 0]]}, "result": [[9.520873670212766e-05], 0, 1.3768088817596436, 1638169901.3465276], "version": 0.2, "tvm_version": "0.8.dev0"}
{"input": ["cuda -keys=cuda,gpu -max_num_threads=1024 -thread_warp_size=32", "conv2d_HWNCnc_tensorcore.cuda", [["TENSOR", [56, 56, 8, 64], "int4"], ["TENSOR", [3, 3, 64, 64], "int4"], 1, 1, 1, "int32"], {}], "config": {"index": 23916, "code_hash": null, "entity": [["block_row_warps", "ot", 1], ["block_col_warps", "ot", 2], ["warp_row_tiles", "ot", 4], ["warp_col_tiles", "ot", 2], ["chunk", "ot", 4], ["split_block_k_nums", "ot", 4], ["vector_ws", "ot", 1], ["vector_as", "ot", 16], ["reorder_inner", "re", [0, 1]], ["AS_double_buffer", "ot", 0], ["WS_double_buffer", "ot", 0], ["auto_unroll_max_step", "ot", 0]]}, "result": [[0.00013295221336553944], 0, 1.3842682838439941, 1638169902.190517], "version": 0.2, "tvm_version": "0.8.dev0"}
{"input": ["cuda -keys=cuda,gpu -max_num_threads=1024 -thread_warp_size=32", "conv2d_HWNCnc_tensorcore.cuda", [["TENSOR", [56, 56, 8, 64], "int4"], ["TENSOR", [3, 3, 64, 64], "int4"], 1, 1, 1, "int32"], {}], "config": {"index": 24141, "code_hash": null, "entity": [["block_row_warps", "ot", 1], ["block_col_warps", "ot", 2], ["warp_row_tiles", "ot", 4], ["warp_col_tiles", "ot", 2], ["chunk", "ot", 8], ["split_block_k_nums", "ot", 4], ["vector_ws", "ot", 1], ["vector_as", "ot", 16], ["reorder_inner", "re", [0, 1]], ["AS_double_buffer", "ot", 0], ["WS_double_buffer", "ot", 0], ["auto_unroll_max_step", "ot", 0]]}, "result": [[0.00013335925], 0, 1.3728785514831543, 1638169903.017432], "version": 0.2, "tvm_version": "0.8.dev0"}
{"input": ["cuda -keys=cuda,gpu -max_num_threads=1024 -thread_warp_size=32", "conv2d_HWNCnc_tensorcore.cuda", [["TENSOR", [56, 56, 8, 64], "int4"], ["TENSOR", [3, 3, 64, 64], "int4"], 1, 1, 1, "int32"], {}], "config": {"index": 120909, "code_hash": null, "entity": [["block_row_warps", "ot", 1], ["block_col_warps", "ot", 2], ["warp_row_tiles", "ot", 16], ["warp_col_tiles", "ot", 2], ["chunk", "ot", 2], ["split_block_k_nums", "ot", 4], ["vector_ws", "ot", 1], ["vector_as", "ot", 16], ["reorder_inner", "re", [1, 0]], ["AS_double_buffer", "ot", 1], ["WS_double_buffer", "ot", 0], ["auto_unroll_max_step", "ot", 0]]}, "result": [[0.00011246435807860262], 0, 1.4283463954925537, 1638169903.924249], "version": 0.2, "tvm_version": "0.8.dev0"}
{"input": ["cuda -keys=cuda,gpu -max_num_threads=1024 -thread_warp_size=32", "conv2d_HWNCnc_tensorcore.cuda", [["TENSOR", [56, 56, 8, 64], "int4"], ["TENSOR", [3, 3, 64, 64], "int4"], 1, 1, 1, "int32"], {}], "config": {"index": 121437, "code_hash": null, "entity": [["block_row_warps", "ot", 1], ["block_col_warps", "ot", 1], ["warp_row_tiles", "ot", 8], ["warp_col_tiles", "ot", 8], ["chunk", "ot", 8], ["split_block_k_nums", "ot", 4], ["vector_ws", "ot", 1], ["vector_as", "ot", 16], ["reorder_inner", "re", [1, 0]], ["AS_double_buffer", "ot", 1], ["WS_double_buffer", "ot", 0], ["auto_unroll_max_step", "ot", 0]]}, "result": [[9.478098881789136e-05], 0, 1.4162945747375488, 1638169904.8071084], "version": 0.2, "tvm_version": "0.8.dev0"}
{"input": ["cuda -keys=cuda,gpu -max_num_threads=1024 -thread_warp_size=32", "conv2d_HWNCnc_tensorcore.cuda", [["TENSOR", [56, 56, 8, 64], "int4"], ["TENSOR", [3, 3, 64, 64], "int4"], 1, 1, 1, "int32"], {}], "config": {"index": 120978, "code_hash": null, "entity": [["block_row_warps", "ot", 1], ["block_col_warps", "ot", 1], ["warp_row_tiles", "ot", 4], ["warp_col_tiles", "ot", 8], ["chunk", "ot", 2], ["split_block_k_nums", "ot", 4], ["vector_ws", "ot", 1], ["vector_as", "ot", 16], ["reorder_inner", "re", [1, 0]], ["AS_double_buffer", "ot", 1], ["WS_double_buffer", "ot", 0], ["auto_unroll_max_step", "ot", 0]]}, "result": [[9.487847099521022e-05], 0, 1.3675589561462402, 1638169905.6478922], "version": 0.2, "tvm_version": "0.8.dev0"}
{"input": ["cuda -keys=cuda,gpu -max_num_threads=1024 -thread_warp_size=32", "conv2d_HWNCnc_tensorcore.cuda", [["TENSOR", [56, 56, 8, 64], "int4"], ["TENSOR", [3, 3, 64, 64], "int4"], 1, 1, 1, "int32"], {}], "config": {"index": 251028, "code_hash": null, "entity": [["block_row_warps", "ot", 1], ["block_col_warps", "ot", 1], ["warp_row_tiles", "ot", 4], ["warp_col_tiles", "ot", 8], ["chunk", "ot", 8], ["split_block_k_nums", "ot", 4], ["vector_ws", "ot", 1], ["vector_as", "ot", 16], ["reorder_inner", "re", [1, 0]], ["AS_double_buffer", "ot", 1], ["WS_double_buffer", "ot", 1], ["auto_unroll_max_step", "ot", 0]]}, "result": [[9.544457978723404e-05], 0, 1.3892581462860107, 1638169906.4949594], "version": 0.2, "tvm_version": "0.8.dev0"}
{"input": ["cuda -keys=cuda,gpu -max_num_threads=1024 -thread_warp_size=32", "conv2d_HWNCnc_tensorcore.cuda", [["TENSOR", [56, 56, 8, 64], "int4"], ["TENSOR", [3, 3, 64, 64], "int4"], 1, 1, 1, "int32"], {}], "config": {"index": 110403, "code_hash": null, "entity": [["block_row_warps", "ot", 1], ["block_col_warps", "ot", 1], ["warp_row_tiles", "ot", 4], ["warp_col_tiles", "ot", 8], ["chunk", "ot", 4], ["split_block_k_nums", "ot", 4], ["vector_ws", "ot", 1], ["vector_as", "ot", 8], ["reorder_inner", "re", [1, 0]], ["AS_double_buffer", "ot", 1], ["WS_double_buffer", "ot", 0], ["auto_unroll_max_step", "ot", 0]]}, "result": [[9.572685326953748e-05], 0, 1.4347789287567139, 1638169907.387166], "version": 0.2, "tvm_version": "0.8.dev0"}
