workspace/logs/resnet50_HWNC_mixed_batch_8.log
{"input": ["cuda", "conv2d_HWNCnc_tensorcore.cuda", [["TENSOR", [56, 56, 8, 64], "uint4"], ["TENSOR", [1, 1, 256, 64], "int4"], [1, 1], [0, 0, 0, 0], [1, 1], "int32"], {}], "config": {"index": 6685446, "code_hash": null, "entity": [["block_row_warps", "ot", 1], ["block_col_warps", "ot", 2], ["warp_row_tiles", "ot", 4], ["warp_col_tiles", "ot", 1], ["chunk", "ot", 2], ["fuse_pack", "ot", 0], ["split_block_k", "ot", 1], ["vector_ws", "ot", 8], ["vector_as", "ot", 1], ["reorder_inner", "re", [1, 0]], ["compute_at_AS", "ot", 3], ["compute_at_WS", "ot", 0], ["AS_double_buffer", "ot", 1], ["WS_double_buffer", "ot", 1], ["auto_unroll_max_step", "ot", 0]]}, "result": [[0.00011201552467656923], 0, 1.5798325538635254, 1626825028.593675], "version": 0.2, "tvm_version": "0.7.dev1"}
{"input": ["cuda", "conv2d_HWNCnc_tensorcore.cuda", [["TENSOR", [58, 58, 8, 64], "uint4"], ["TENSOR", [3, 3, 64, 64], "int4"], [1, 1], [0, 0, 0, 0], [1, 1], "int32"], {}], "config": {"index": 21971430, "code_hash": null, "entity": [["block_row_warps", "ot", 1], ["block_col_warps", "ot", 1], ["warp_row_tiles", "ot", 1], ["warp_col_tiles", "ot", 16], ["chunk", "ot", 4], ["fuse_pack", "ot", 0], ["split_block_k", "ot", 4], ["vector_ws", "ot", 1], ["vector_as", "ot", 1], ["reorder_inner", "re", [1, 0]], ["compute_at_AS", "ot", 1], ["compute_at_WS", "ot", 2], ["AS_double_buffer", "ot", 0], ["WS_double_buffer", "ot", 1], ["auto_unroll_max_step", "ot", 1500]]}, "result": [[5.7454268476621423e-05], 0, 1.774594783782959, 1626823743.712563], "version": 0.2, "tvm_version": "0.7.dev1"}
{"input": ["cuda", "conv2d_HWNCnc_tensorcore.cuda", [["TENSOR", [56, 56, 8, 256], "uint4"], ["TENSOR", [1, 1, 64, 256], "int4"], [1, 1], [0, 0, 0, 0], [1, 1], "int32"], {}], "config": {"index": 22499073, "code_hash": null, "entity": [["block_row_warps", "ot", 1], ["block_col_warps", "ot", 1], ["warp_row_tiles", "ot", 4], ["warp_col_tiles", "ot", 16], ["chunk", "ot", 8], ["fuse_pack", "ot", 0], ["split_block_k", "ot", 2], ["vector_ws", "ot", 8], ["vector_as", "ot", 1], ["reorder_inner", "re", [1, 0]], ["compute_at_AS", "ot", 1], ["compute_at_WS", "ot", 3], ["AS_double_buffer", "ot", 0], ["WS_double_buffer", "ot", 1], ["auto_unroll_max_step", "ot", 1500]]}, "result": [[4.31712820586544e-05], 0, 1.2902727127075195, 1626820445.1680853], "version": 0.2, "tvm_version": "0.7.dev1"}
{"input": ["cuda", "conv2d_HWNCnc_tensorcore.cuda", [["TENSOR", [56, 56, 8, 64], "uint4"], ["TENSOR", [1, 1, 64, 64], "int4"], [1, 1], [0, 0, 0, 0], [1, 1], "int32"], {}], "config": {"index": 18864721, "code_hash": null, "entity": [["block_row_warps", "ot", 2], ["block_col_warps", "ot", 1], ["warp_row_tiles", "ot", 1], ["warp_col_tiles", "ot", 2], ["chunk", "ot", 8], ["fuse_pack", "ot", 0], ["split_block_k", "ot", 16], ["vector_ws", "ot", 1], ["vector_as", "ot", 1], ["reorder_inner", "re", [1, 0]], ["compute_at_AS", "ot", 1], ["compute_at_WS", "ot", 0], ["AS_double_buffer", "ot", 1], ["WS_double_buffer", "ot", 0], ["auto_unroll_max_step", "ot", 1500]]}, "result": [[3.235287250887251e-05], 0, 1.7948007583618164, 1626817439.2011442], "version": 0.2, "tvm_version": "0.7.dev1"}
{"input": ["cuda", "conv2d_nhwc_tensorcore_im2col.cuda", [["TENSOR", [8, 230, 230, 3], "int8"], ["TENSOR", [7, 7, 64, 3], "int8"], [2, 2], [0, 0, 0, 0], [1, 1], "NHWC", "int32"], {}], "config": {"index": 11334, "code_hash": null, "entity": [["block_row_warps", "ot", 4], ["block_col_warps", "ot", 2], ["warp_row_tiles", "ot", 1], ["warp_col_tiles", "ot", 2], ["chunk", "ot", 16], ["vector_width", "ot", 8], ["fuse_im2col", "ot", 1]]}, "result": [[0.00036524355582524267], 0, 1.2705764770507812, 1626815083.1996264], "version": 0.2, "tvm_version": "0.7.dev1"}
{"input": ["cuda", "conv2d_HWNCnc_tensorcore.cuda", [["TENSOR", [56, 56, 8, 256], "uint4"], ["TENSOR", [1, 1, 512, 256], "int4"], [2, 2], [0, 0, 0, 0], [1, 1], "int32"], {}], "config": {"index": 21191805, "code_hash": null, "entity": [["block_row_warps", "ot", 1], ["block_col_warps", "ot", 1], ["warp_row_tiles", "ot", 1], ["warp_col_tiles", "ot", 16], ["chunk", "ot", 2], ["fuse_pack", "ot", 0], ["split_block_k", "ot", 2], ["vector_ws", "ot", 1], ["vector_as", "ot", 1], ["reorder_inner", "re", [1, 0]], ["compute_at_AS", "ot", 3], ["compute_at_WS", "ot", 0], ["AS_double_buffer", "ot", 0], ["WS_double_buffer", "ot", 1], ["auto_unroll_max_step", "ot", 1500]]}, "result": [[6.766607792754845e-05], 0, 1.4706332683563232, 1626814709.761049], "version": 0.2, "tvm_version": "0.7.dev1"}
{"input": ["cuda", "conv2d_HWNCnc_tensorcore.cuda", [["TENSOR", [28, 28, 8, 512], "uint4"], ["TENSOR", [1, 1, 1024, 512], "int4"], [2, 2], [0, 0, 0, 0], [1, 1], "int32"], {}], "config": {"index": 14972991, "code_hash": null, "entity": [["block_row_warps", "ot", 1], ["block_col_warps", "ot", 4], ["warp_row_tiles", "ot", 1], ["warp_col_tiles", "ot", 8], ["chunk", "ot", 4], ["fuse_pack", "ot", 0], ["split_block_k", "ot", 4], ["vector_ws", "ot", 1], ["vector_as", "ot", 1], ["reorder_inner", "re", [1, 0]], ["compute_at_AS", "ot", 3], ["compute_at_WS", "ot", 0], ["AS_double_buffer", "ot", 1], ["WS_double_buffer", "ot", 1], ["auto_unroll_max_step", "ot", 512]]}, "result": [[5.4278016375934494e-05], 0, 1.957810401916504, 1626809673.4415767], "version": 0.2, "tvm_version": "0.7.dev1"}
{"input": ["cuda", "conv2d_HWNCnc_tensorcore.cuda", [["TENSOR", [14, 14, 8, 1024], "uint4"], ["TENSOR", [1, 1, 2048, 1024], "int4"], [2, 2], [0, 0, 0, 0], [1, 1], "int32"], {}], "config": {"index": 8230008, "code_hash": null, "entity": [["block_row_warps", "ot", 1], ["block_col_warps", "ot", 2], ["warp_row_tiles", "ot", 1], ["warp_col_tiles", "ot", 16], ["chunk", "ot", 2], ["fuse_pack", "ot", 0], ["split_block_k", "ot", 1], ["vector_ws", "ot", 1], ["vector_as", "ot", 1], ["reorder_inner", "re", [1, 0]], ["compute_at_AS", "ot", 3], ["compute_at_WS", "ot", 3], ["AS_double_buffer", "ot", 1], ["WS_double_buffer", "ot", 1], ["auto_unroll_max_step", "ot", 0]]}, "result": [[6.603082907742998e-05], 0, 1.6121666431427002, 1626806654.3983474], "version": 0.2, "tvm_version": "0.7.dev1"}
{"input": ["cuda", "conv2d_HWNCnc_tensorcore.cuda", [["TENSOR", [7, 7, 8, 512], "int8"], ["TENSOR", [1, 1, 2048, 512], "int8"], [1, 1], [0, 0, 0, 0], [1, 1], "int32"], {}], "config": {"index": 10866024, "code_hash": null, "entity": [["block_row_warps", "ot", 1], ["block_col_warps", "ot", 1], ["warp_row_tiles", "ot", 2], ["warp_col_tiles", "ot", 4], ["chunk", "ot", 2], ["fuse_pack", "ot", 1], ["split_block_k", "ot", 1], ["vector_ws", "ot", 1], ["vector_as", "ot", 16], ["reorder_inner", "re", [1, 0]], ["compute_at_AS", "ot", 3], ["compute_at_WS", "ot", 0], ["AS_double_buffer", "ot", 1], ["WS_double_buffer", "ot", 0], ["auto_unroll_max_step", "ot", 512]]}, "result": [[6.1378937531742e-05], 0, 1.8049125671386719, 1626803023.9641063], "version": 0.2, "tvm_version": "0.7.dev1"}
{"input": ["cuda", "conv2d_HWNCnc_tensorcore.cuda", [["TENSOR", [9, 9, 8, 512], "int8"], ["TENSOR", [3, 3, 512, 512], "int8"], [1, 1], [0, 0, 0, 0], [1, 1], "int32"], {}], "config": {"index": 7172469, "code_hash": null, "entity": [["block_row_warps", "ot", 1], ["block_col_warps", "ot", 1], ["warp_row_tiles", "ot", 2], ["warp_col_tiles", "ot", 8], ["chunk", "ot", 2], ["fuse_pack", "ot", 1], ["split_block_k", "ot", 1], ["vector_ws", "ot", 1], ["vector_as", "ot", 16], ["reorder_inner", "re", [0, 1]], ["compute_at_AS", "ot", 3], ["compute_at_WS", "ot", 1], ["AS_double_buffer", "ot", 1], ["WS_double_buffer", "ot", 1], ["auto_unroll_max_step", "ot", 0]]}, "result": [[0.00013099386216216215], 0, 1.7245886325836182, 1626799823.2326264], "version": 0.2, "tvm_version": "0.7.dev1"}
{"input": ["cuda", "conv2d_HWNCnc_tensorcore.cuda", [["TENSOR", [7, 7, 8, 2048], "int8"], ["TENSOR", [1, 1, 512, 2048], "int8"], [1, 1], [0, 0, 0, 0], [1, 1], "int32"], {}], "config": {"index": 21493476, "code_hash": null, "entity": [["block_row_warps", "ot", 1], ["block_col_warps", "ot", 1], ["warp_row_tiles", "ot", 16], ["warp_col_tiles", "ot", 4], ["chunk", "ot", 4], ["fuse_pack", "ot", 1], ["split_block_k", "ot", 1], ["vector_ws", "ot", 1], ["vector_as", "ot", 16], ["reorder_inner", "re", [1, 0]], ["compute_at_AS", "ot", 1], ["compute_at_WS", "ot", 1], ["AS_double_buffer", "ot", 0], ["WS_double_buffer", "ot", 1], ["auto_unroll_max_step", "ot", 1500]]}, "result": [[6.163745130035695e-05], 0, 1.7103278636932373, 1626797256.668341], "version": 0.2, "tvm_version": "0.7.dev1"}
{"input": ["cuda", "conv2d_HWNCnc_tensorcore.cuda", [["TENSOR", [14, 14, 8, 1024], "int8"], ["TENSOR", [1, 1, 512, 1024], "int8"], [2, 2], [0, 0, 0, 0], [1, 1], "int32"], {}], "config": {"index": 4363743, "code_hash": null, "entity": [["block_row_warps", "ot", 1], ["block_col_warps", "ot", 2], ["warp_row_tiles", "ot", 1], ["warp_col_tiles", "ot", 4], ["chunk", "ot", 4], ["fuse_pack", "ot", 0], ["split_block_k", "ot", 1], ["vector_ws", "ot", 1], ["vector_as", "ot", 8], ["reorder_inner", "re", [1, 0]], ["compute_at_AS", "ot", 1], ["compute_at_WS", "ot", 0], ["AS_double_buffer", "ot", 0], ["WS_double_buffer", "ot", 1], ["auto_unroll_max_step", "ot", 0]]}, "result": [[3.506204324956166e-05], 0, 1.6566314697265625, 1626794162.424805], "version": 0.2, "tvm_version": "0.7.dev1"}
{"input": ["cuda", "conv2d_HWNCnc_tensorcore.cuda", [["TENSOR", [16, 16, 8, 256], "int8"], ["TENSOR", [3, 3, 256, 256], "int8"], [1, 1], [0, 0, 0, 0], [1, 1], "int32"], {}], "config": {"index": 8857791, "code_hash": null, "entity": [["block_row_warps", "ot", 1], ["block_col_warps", "ot", 1], ["warp_row_tiles", "ot", 16], ["warp_col_tiles", "ot", 16], ["chunk", "ot", 8], ["fuse_pack", "ot", 1], ["split_block_k", "ot", 1], ["vector_ws", "ot", 1], ["vector_as", "ot", 16], ["reorder_inner", "re", [0, 1]], ["compute_at_AS", "ot", 0], ["compute_at_WS", "ot", 1], ["AS_double_buffer", "ot", 0], ["WS_double_buffer", "ot", 0], ["auto_unroll_max_step", "ot", 512]]}, "result": [[0.00011942016576221017], 0, 1.7234842777252197, 1626787616.339072], "version": 0.2, "tvm_version": "0.7.dev1"}
{"input": ["cuda", "conv2d_HWNCnc_tensorcore.cuda", [["TENSOR", [28, 28, 8, 128], "int8"], ["TENSOR", [1, 1, 512, 128], "int8"], [1, 1], [0, 0, 0, 0], [1, 1], "int32"], {}], "config": {"index": 18649404, "code_hash": null, "entity": [["block_row_warps", "ot", 1], ["block_col_warps", "ot", 1], ["warp_row_tiles", "ot", 2], ["warp_col_tiles", "ot", 2], ["chunk", "ot", 4], ["fuse_pack", "ot", 1], ["split_block_k", "ot", 16], ["vector_ws", "ot", 1], ["vector_as", "ot", 16], ["reorder_inner", "re", [1, 0]], ["compute_at_AS", "ot", 3], ["compute_at_WS", "ot", 3], ["AS_double_buffer", "ot", 0], ["WS_double_buffer", "ot", 0], ["auto_unroll_max_step", "ot", 1500]]}, "result": [[7.733367996171027e-05], 0, 2.3793957233428955, 1626777304.6411343], "version": 0.2, "tvm_version": "0.7.dev1"}
{"input": ["cuda", "conv2d_HWNCnc_tensorcore.cuda", [["TENSOR", [30, 30, 8, 128], "int8"], ["TENSOR", [3, 3, 128, 128], "int8"], [1, 1], [0, 0, 0, 0], [1, 1], "int32"], {}], "config": {"index": 16827840, "code_hash": null, "entity": [["block_row_warps", "ot", 1], ["block_col_warps", "ot", 1], ["warp_row_tiles", "ot", 1], ["warp_col_tiles", "ot", 4], ["chunk", "ot", 4], ["fuse_pack", "ot", 1], ["split_block_k", "ot", 1], ["vector_ws", "ot", 1], ["vector_as", "ot", 16], ["reorder_inner", "re", [1, 0]], ["compute_at_AS", "ot", 1], ["compute_at_WS", "ot", 0], ["AS_double_buffer", "ot", 0], ["WS_double_buffer", "ot", 0], ["auto_unroll_max_step", "ot", 1500]]}, "result": [[0.00012521891267753814], 0, 2.3438937664031982, 1626774753.9569366], "version": 0.2, "tvm_version": "0.7.dev1"}
{"input": ["cuda", "conv2d_HWNCnc_tensorcore.cuda", [["TENSOR", [28, 28, 8, 512], "int8"], ["TENSOR", [1, 1, 128, 512], "int8"], [1, 1], [0, 0, 0, 0], [1, 1], "int32"], {}], "config": {"index": 14883132, "code_hash": null, "entity": [["block_row_warps", "ot", 1], ["block_col_warps", "ot", 2], ["warp_row_tiles", "ot", 2], ["warp_col_tiles", "ot", 2], ["chunk", "ot", 8], ["fuse_pack", "ot", 0], ["split_block_k", "ot", 1], ["vector_ws", "ot", 1], ["vector_as", "ot", 16], ["reorder_inner", "re", [1, 0]], ["compute_at_AS", "ot", 2], ["compute_at_WS", "ot", 0], ["AS_double_buffer", "ot", 1], ["WS_double_buffer", "ot", 1], ["auto_unroll_max_step", "ot", 512]]}, "result": [[8.179750507786052e-05], 0, 1.8714520931243896, 1626770992.5547733], "version": 0.2, "tvm_version": "0.7.dev1"}
{"input": ["cuda", "conv2d_HWNCnc_tensorcore.cuda", [["TENSOR", [56, 56, 8, 256], "int8"], ["TENSOR", [1, 1, 128, 256], "int8"], [2, 2], [0, 0, 0, 0], [1, 1], "int32"], {}], "config": {"index": 8775759, "code_hash": null, "entity": [["block_row_warps", "ot", 1], ["block_col_warps", "ot", 2], ["warp_row_tiles", "ot", 16], ["warp_col_tiles", "ot", 2], ["chunk", "ot", 8], ["fuse_pack", "ot", 0], ["split_block_k", "ot", 8], ["vector_ws", "ot", 1], ["vector_as", "ot", 8], ["reorder_inner", "re", [1, 0]], ["compute_at_AS", "ot", 3], ["compute_at_WS", "ot", 0], ["AS_double_buffer", "ot", 0], ["WS_double_buffer", "ot", 0], ["auto_unroll_max_step", "ot", 512]]}, "result": [[3.9741197364030695e-05], 0, 1.9139509201049805, 1626769071.5076132], "version": 0.2, "tvm_version": "0.7.dev1"}
{"input": ["cuda", "conv2d_HWNCnc_tensorcore.cuda", [["TENSOR", [56, 56, 8, 64], "int8"], ["TENSOR", [1, 1, 256, 64], "int8"], [1, 1], [0, 0, 0, 0], [1, 1], "int32"], {}], "config": {"index": 3046323, "code_hash": null, "entity": [["block_row_warps", "ot", 1], ["block_col_warps", "ot", 2], ["warp_row_tiles", "ot", 1], ["warp_col_tiles", "ot", 2], ["chunk", "ot", 8], ["fuse_pack", "ot", 0], ["split_block_k", "ot", 1], ["vector_ws", "ot", 1], ["vector_as", "ot", 1], ["reorder_inner", "re", [1, 0]], ["compute_at_AS", "ot", 3], ["compute_at_WS", "ot", 1], ["AS_double_buffer", "ot", 1], ["WS_double_buffer", "ot", 0], ["auto_unroll_max_step", "ot", 0]]}, "result": [[0.00011992160889808588], 0, 1.6055598258972168, 1626765438.1389215], "version": 0.2, "tvm_version": "0.7.dev1"}
{"input": ["cuda", "conv2d_HWNCnc_tensorcore.cuda", [["TENSOR", [58, 58, 8, 64], "int8"], ["TENSOR", [3, 3, 64, 64], "int8"], [1, 1], [0, 0, 0, 0], [1, 1], "int32"], {}], "config": {"index": 14887614, "code_hash": null, "entity": [["block_row_warps", "ot", 1], ["block_col_warps", "ot", 2], ["warp_row_tiles", "ot", 16], ["warp_col_tiles", "ot", 1], ["chunk", "ot", 8], ["fuse_pack", "ot", 1], ["split_block_k", "ot", 4], ["vector_ws", "ot", 1], ["vector_as", "ot", 16], ["reorder_inner", "re", [1, 0]], ["compute_at_AS", "ot", 2], ["compute_at_WS", "ot", 0], ["AS_double_buffer", "ot", 1], ["WS_double_buffer", "ot", 1], ["auto_unroll_max_step", "ot", 512]]}, "result": [[0.00012873373908355796], 0, 1.791529655456543, 1626762610.8010445], "version": 0.2, "tvm_version": "0.7.dev1"}
{"input": ["cuda", "conv2d_HWNCnc_tensorcore.cuda", [["TENSOR", [56, 56, 8, 256], "int8"], ["TENSOR", [1, 1, 64, 256], "int8"], [1, 1], [0, 0, 0, 0], [1, 1], "int32"], {}], "config": {"index": 11886219, "code_hash": null, "entity": [["block_row_warps", "ot", 1], ["block_col_warps", "ot", 1], ["warp_row_tiles", "ot", 2], ["warp_col_tiles", "ot", 8], ["chunk", "ot", 8], ["fuse_pack", "ot", 0], ["split_block_k", "ot", 8], ["vector_ws", "ot", 1], ["vector_as", "ot", 8], ["reorder_inner", "re", [1, 0]], ["compute_at_AS", "ot", 3], ["compute_at_WS", "ot", 2], ["AS_double_buffer", "ot", 1], ["WS_double_buffer", "ot", 0], ["auto_unroll_max_step", "ot", 512]]}, "result": [[9.917794054940549e-05], 0, 1.9555940628051758, 1626760155.6534424], "version": 0.2, "tvm_version": "0.7.dev1"}
{"input": ["cuda", "conv2d_HWNCnc_tensorcore.cuda", [["TENSOR", [56, 56, 8, 64], "int8"], ["TENSOR", [1, 1, 64, 64], "int8"], [1, 1], [0, 0, 0, 0], [1, 1], "int32"], {}], "config": {"index": 7690095, "code_hash": null, "entity": [["block_row_warps", "ot", 1], ["block_col_warps", "ot", 1], ["warp_row_tiles", "ot", 1], ["warp_col_tiles", "ot", 2], ["chunk", "ot", 4], ["fuse_pack", "ot", 0], ["split_block_k", "ot", 1], ["vector_ws", "ot", 1], ["vector_as", "ot", 16], ["reorder_inner", "re", [0, 1]], ["compute_at_AS", "ot", 3], ["compute_at_WS", "ot", 2], ["AS_double_buffer", "ot", 1], ["WS_double_buffer", "ot", 1], ["auto_unroll_max_step", "ot", 0]]}, "result": [[3.7759953007518795e-05], 0, 1.6470215320587158, 1626758559.7683947], "version": 0.2, "tvm_version": "0.7.dev1"}
{"input": ["cuda", "conv2d_HWNCnc_tensorcore.cuda", [["TENSOR", [56, 56, 8, 256], "int8"], ["TENSOR", [1, 1, 512, 256], "int8"], [2, 2], [0, 0, 0, 0], [1, 1], "int32"], {}], "config": {"index": 10870737, "code_hash": null, "entity": [["block_row_warps", "ot", 1], ["block_col_warps", "ot", 4], ["warp_row_tiles", "ot", 16], ["warp_col_tiles", "ot", 2], ["chunk", "ot", 4], ["fuse_pack", "ot", 0], ["split_block_k", "ot", 8], ["vector_ws", "ot", 1], ["vector_as", "ot", 16], ["reorder_inner", "re", [1, 0]], ["compute_at_AS", "ot", 3], ["compute_at_WS", "ot", 0], ["AS_double_buffer", "ot", 1], ["WS_double_buffer", "ot", 0], ["auto_unroll_max_step", "ot", 512]]}, "result": [[0.00011922760895228727], 0, 1.8960683345794678, 1626753979.0648515], "version": 0.2, "tvm_version": "0.7.dev1"}
{"input": ["cuda", "conv2d_HWNCnc_tensorcore.cuda", [["TENSOR", [28, 28, 8, 512], "int8"], ["TENSOR", [1, 1, 1024, 512], "int8"], [2, 2], [0, 0, 0, 0], [1, 1], "int32"], {}], "config": {"index": 18122748, "code_hash": null, "entity": [["block_row_warps", "ot", 1], ["block_col_warps", "ot", 4], ["warp_row_tiles", "ot", 8], ["warp_col_tiles", "ot", 4], ["chunk", "ot", 2], ["fuse_pack", "ot", 0], ["split_block_k", "ot", 1], ["vector_ws", "ot", 1], ["vector_as", "ot", 16], ["reorder_inner", "re", [1, 0]], ["compute_at_AS", "ot", 3], ["compute_at_WS", "ot", 2], ["AS_double_buffer", "ot", 0], ["WS_double_buffer", "ot", 0], ["auto_unroll_max_step", "ot", 1500]]}, "result": [[0.00013154411557512384], 0, 2.0119807720184326, 1626751707.0632238], "version": 0.2, "tvm_version": "0.7.dev1"}
{"input": ["cuda", "conv2d_HWNCnc_tensorcore.cuda", [["TENSOR", [14, 14, 8, 1024], "int8"], ["TENSOR", [1, 1, 2048, 1024], "int8"], [2, 2], [0, 0, 0, 0], [1, 1], "int32"], {}], "config": {"index": 13436607, "code_hash": null, "entity": [["block_row_warps", "ot", 1], ["block_col_warps", "ot", 2], ["warp_row_tiles", "ot", 2], ["warp_col_tiles", "ot", 2], ["chunk", "ot", 4], ["fuse_pack", "ot", 1], ["split_block_k", "ot", 1], ["vector_ws", "ot", 1], ["vector_as", "ot", 8], ["reorder_inner", "re", [1, 0]], ["compute_at_AS", "ot", 3], ["compute_at_WS", "ot", 1], ["AS_double_buffer", "ot", 0], ["WS_double_buffer", "ot", 1], ["auto_unroll_max_step", "ot", 512]]}, "result": [[0.00013532413963963965], 0, 1.5205278396606445, 1626747547.4463537], "version": 0.2, "tvm_version": "0.7.dev1"}
{"input": ["cuda", "dense_int8.cuda", [["TENSOR", [8, 2048], "int8"], ["TENSOR", [1000, 2048], "int8"], null, "int32"], {}], "config": {"index": 52049, "code_hash": null, "entity": [["tile_y", "sp", [-1, 1, 8, 1]], ["tile_x", "sp", [-1, 1, 2, 5]], ["tile_k", "sp", [-1, 64]], ["auto_unroll_max_step", "ot", 0]]}, "result": [[1.2870921422523285e-05], 0, 1.6495592594146729, 1597285024.0789788], "version": 0.2, "tvm_version": "0.7.dev1"}
{"input": ["cuda", "conv2d_HWNCnc_tensorcore.cuda", [["TENSOR", [7, 7, 8, 512], "uint4"], ["TENSOR", [1, 1, 2048, 512], "int4"], [1, 1], [0, 0, 0, 0], [1, 1], "int32"], {}], "config": {"index": 10349499, "code_hash": null, "entity": [["block_row_warps", "ot", 1], ["block_col_warps", "ot", 2], ["warp_row_tiles", "ot", 16], ["warp_col_tiles", "ot", 8], ["chunk", "ot", 2], ["fuse_pack", "ot", 1], ["split_block_k", "ot", 2], ["vector_ws", "ot", 1], ["vector_as", "ot", 16], ["reorder_inner", "re", [1, 0]], ["compute_at_AS", "ot", 3], ["compute_at_WS", "ot", 3], ["AS_double_buffer", "ot", 0], ["WS_double_buffer", "ot", 0], ["auto_unroll_max_step", "ot", 512]]}, "result": [[3.5737200398142e-05], 0, 2.301682472229004, 1597282608.6348987], "version": 0.2, "tvm_version": "0.7.dev1"}
{"input": ["cuda", "conv2d_HWNCnc_tensorcore.cuda", [["TENSOR", [9, 9, 8, 512], "uint4"], ["TENSOR", [3, 3, 512, 512], "int4"], [1, 1], [0, 0, 0, 0], [1, 1], "int32"], {}], "config": {"index": 17951121, "code_hash": null, "entity": [["block_row_warps", "ot", 1], ["block_col_warps", "ot", 1], ["warp_row_tiles", "ot", 16], ["warp_col_tiles", "ot", 8], ["chunk", "ot", 4], ["fuse_pack", "ot", 1], ["split_block_k", "ot", 1], ["vector_ws", "ot", 1], ["vector_as", "ot", 1], ["reorder_inner", "re", [1, 0]], ["compute_at_AS", "ot", 2], ["compute_at_WS", "ot", 2], ["AS_double_buffer", "ot", 0], ["WS_double_buffer", "ot", 0], ["auto_unroll_max_step", "ot", 1500]]}, "result": [[7.820361671612265e-05], 0, 2.6768016815185547, 1597281164.2182095], "version": 0.2, "tvm_version": "0.7.dev1"}
{"input": ["cuda", "conv2d_HWNCnc_tensorcore.cuda", [["TENSOR", [7, 7, 8, 2048], "uint4"], ["TENSOR", [1, 1, 512, 2048], "int4"], [1, 1], [0, 0, 0, 0], [1, 1], "int32"], {}], "config": {"index": 7097085, "code_hash": null, "entity": [["block_row_warps", "ot", 1], ["block_col_warps", "ot", 1], ["warp_row_tiles", "ot", 1], ["warp_col_tiles", "ot", 8], ["chunk", "ot", 4], ["fuse_pack", "ot", 1], ["split_block_k", "ot", 1], ["vector_ws", "ot", 8], ["vector_as", "ot", 8], ["reorder_inner", "re", [1, 0]], ["compute_at_AS", "ot", 2], ["compute_at_WS", "ot", 1], ["AS_double_buffer", "ot", 1], ["WS_double_buffer", "ot", 1], ["auto_unroll_max_step", "ot", 0]]}, "result": [[4.1829677683765206e-05], 0, 1.6437132358551025, 1597280199.8695824], "version": 0.2, "tvm_version": "0.7.dev1"}
{"input": ["cuda", "conv2d_HWNCnc_tensorcore.cuda", [["TENSOR", [16, 16, 8, 512], "uint4"], ["TENSOR", [3, 3, 512, 512], "int4"], [2, 2], [0, 0, 0, 0], [1, 1], "int32"], {}], "config": {"index": 12140490, "code_hash": null, "entity": [["block_row_warps", "ot", 1], ["block_col_warps", "ot", 2], ["warp_row_tiles", "ot", 8], ["warp_col_tiles", "ot", 8], ["chunk", "ot", 2], ["fuse_pack", "ot", 1], ["split_block_k", "ot", 1], ["vector_ws", "ot", 1], ["vector_as", "ot", 8], ["reorder_inner", "re", [1, 0]], ["compute_at_AS", "ot", 1], ["compute_at_WS", "ot", 3], ["AS_double_buffer", "ot", 1], ["WS_double_buffer", "ot", 0], ["auto_unroll_max_step", "ot", 512]]}, "result": [[8.585496518987341e-05], 0, 1.7868223190307617, 1597279120.045563], "version": 0.2, "tvm_version": "0.7.dev1"}
{"input": ["cuda", "conv2d_HWNCnc_tensorcore.cuda", [["TENSOR", [14, 14, 8, 1024], "uint4"], ["TENSOR", [1, 1, 512, 1024], "int4"], [1, 1], [0, 0, 0, 0], [1, 1], "int32"], {}], "config": {"index": 18353583, "code_hash": null, "entity": [["block_row_warps", "ot", 1], ["block_col_warps", "ot", 1], ["warp_row_tiles", "ot", 4], ["warp_col_tiles", "ot", 4], ["chunk", "ot", 8], ["fuse_pack", "ot", 0], ["split_block_k", "ot", 4], ["vector_ws", "ot", 8], ["vector_as", "ot", 1], ["reorder_inner", "re", [1, 0]], ["compute_at_AS", "ot", 1], ["compute_at_WS", "ot", 3], ["AS_double_buffer", "ot", 0], ["WS_double_buffer", "ot", 0], ["auto_unroll_max_step", "ot", 1500]]}, "result": [[7.707911588604539e-05], 0, 1.5791685581207275, 1597277600.7648766], "version": 0.2, "tvm_version": "0.7.dev1"}
{"input": ["cuda", "conv2d_HWNCnc_tensorcore.cuda", [["TENSOR", [14, 14, 8, 256], "uint4"], ["TENSOR", [1, 1, 1024, 256], "int4"], [1, 1], [0, 0, 0, 0], [1, 1], "int32"], {}], "config": {"index": 14724621, "code_hash": null, "entity": [["block_row_warps", "ot", 1], ["block_col_warps", "ot", 1], ["warp_row_tiles", "ot", 16], ["warp_col_tiles", "ot", 8], ["chunk", "ot", 4], ["fuse_pack", "ot", 0], ["split_block_k", "ot", 4], ["vector_ws", "ot", 8], ["vector_as", "ot", 1], ["reorder_inner", "re", [1, 0]], ["compute_at_AS", "ot", 1], ["compute_at_WS", "ot", 0], ["AS_double_buffer", "ot", 1], ["WS_double_buffer", "ot", 1], ["auto_unroll_max_step", "ot", 512]]}, "result": [[3.8436940539294765e-05], 0, 1.9319663047790527, 1597275993.9598455], "version": 0.2, "tvm_version": "0.7.dev1"}
{"input": ["cuda", "conv2d_HWNCnc_tensorcore.cuda", [["TENSOR", [30, 30, 8, 256], "uint4"], ["TENSOR", [3, 3, 256, 256], "int4"], [2, 2], [0, 0, 0, 0], [1, 1], "int32"], {}], "config": {"index": 19375602, "code_hash": null, "entity": [["block_row_warps", "ot", 1], ["block_col_warps", "ot", 4], ["warp_row_tiles", "ot", 16], ["warp_col_tiles", "ot", 8], ["chunk", "ot", 2], ["fuse_pack", "ot", 0], ["split_block_k", "ot", 1], ["vector_ws", "ot", 1], ["vector_as", "ot", 1], ["reorder_inner", "re", [1, 0]], ["compute_at_AS", "ot", 1], ["compute_at_WS", "ot", 1], ["AS_double_buffer", "ot", 1], ["WS_double_buffer", "ot", 0], ["auto_unroll_max_step", "ot", 1500]]}, "result": [[7.584285009861933e-05], 0, 10.431355237960815, 1597271964.0190082], "version": 0.2, "tvm_version": "0.7.dev1"}
{"input": ["cuda", "conv2d_HWNCnc_tensorcore.cuda", [["TENSOR", [28, 28, 8, 512], "uint4"], ["TENSOR", [1, 1, 256, 512], "int4"], [1, 1], [0, 0, 0, 0], [1, 1], "int32"], {}], "config": {"index": 23278200, "code_hash": null, "entity": [["block_row_warps", "ot", 1], ["block_col_warps", "ot", 4], ["warp_row_tiles", "ot", 2], ["warp_col_tiles", "ot", 8], ["chunk", "ot", 4], ["fuse_pack", "ot", 0], ["split_block_k", "ot", 4], ["vector_ws", "ot", 8], ["vector_as", "ot", 1], ["reorder_inner", "re", [1, 0]], ["compute_at_AS", "ot", 3], ["compute_at_WS", "ot", 0], ["AS_double_buffer", "ot", 1], ["WS_double_buffer", "ot", 1], ["auto_unroll_max_step", "ot", 1500]]}, "result": [[6.092620718132854e-05], 0, 2.6594135761260986, 1597270229.7414277], "version": 0.2, "tvm_version": "0.7.dev1"}
{"input": ["cuda", "conv2d_HWNCnc_tensorcore.cuda", [["TENSOR", [28, 28, 8, 128], "uint4"], ["TENSOR", [1, 1, 512, 128], "int4"], [1, 1], [0, 0, 0, 0], [1, 1], "int32"], {}], "config": {"index": 18403596, "code_hash": null, "entity": [["block_row_warps", "ot", 1], ["block_col_warps", "ot", 1], ["warp_row_tiles", "ot", 16], ["warp_col_tiles", "ot", 8], ["chunk", "ot", 2], ["fuse_pack", "ot", 0], ["split_block_k", "ot", 1], ["vector_ws", "ot", 1], ["vector_as", "ot", 1], ["reorder_inner", "re", [0, 1]], ["compute_at_AS", "ot", 2], ["compute_at_WS", "ot", 3], ["AS_double_buffer", "ot", 0], ["WS_double_buffer", "ot", 0], ["auto_unroll_max_step", "ot", 1500]]}, "result": [[5.7968033289986996e-05], 0, 1.9137954711914062, 1597268341.3513372], "version": 0.2, "tvm_version": "0.7.dev1"}
{"input": ["cuda", "conv2d_HWNCnc_tensorcore.cuda", [["TENSOR", [30, 30, 8, 128], "uint4"], ["TENSOR", [3, 3, 128, 128], "int4"], [1, 1], [0, 0, 0, 0], [1, 1], "int32"], {}], "config": {"index": 20179455, "code_hash": null, "entity": [["block_row_warps", "ot", 1], ["block_col_warps", "ot", 4], ["warp_row_tiles", "ot", 2], ["warp_col_tiles", "ot", 4], ["chunk", "ot", 4], ["fuse_pack", "ot", 1], ["split_block_k", "ot", 4], ["vector_ws", "ot", 1], ["vector_as", "ot", 8], ["reorder_inner", "re", [1, 0]], ["compute_at_AS", "ot", 3], ["compute_at_WS", "ot", 2], ["AS_double_buffer", "ot", 1], ["WS_double_buffer", "ot", 0], ["auto_unroll_max_step", "ot", 1500]]}, "result": [[6.90106583935018e-05], 0, 2.488347053527832, 1597266760.8799942], "version": 0.2, "tvm_version": "0.7.dev1"}
{"input": ["cuda", "conv2d_HWNCnc_tensorcore.cuda", [["TENSOR", [58, 58, 8, 128], "uint4"], ["TENSOR", [3, 3, 128, 128], "int4"], [2, 2], [0, 0, 0, 0], [1, 1], "int32"], {}], "config": {"index": 18986841, "code_hash": null, "entity": [["block_row_warps", "ot", 1], ["block_col_warps", "ot", 1], ["warp_row_tiles", "ot", 16], ["warp_col_tiles", "ot", 16], ["chunk", "ot", 2], ["fuse_pack", "ot", 0], ["split_block_k", "ot", 1], ["vector_ws", "ot", 1], ["vector_as", "ot", 1], ["reorder_inner", "re", [1, 0]], ["compute_at_AS", "ot", 2], ["compute_at_WS", "ot", 0], ["AS_double_buffer", "ot", 1], ["WS_double_buffer", "ot", 0], ["auto_unroll_max_step", "ot", 1500]]}, "result": [[8.10006155378486e-05], 0, 3.6323509216308594, 1597264098.9308164], "version": 0.2, "tvm_version": "0.7.dev1"}
{"input": ["cuda", "conv2d_HWNCnc_tensorcore.cuda", [["TENSOR", [56, 56, 8, 256], "uint4"], ["TENSOR", [1, 1, 128, 256], "int4"], [1, 1], [0, 0, 0, 0], [1, 1], "int32"], {}], "config": {"index": 10836873, "code_hash": null, "entity": [["block_row_warps", "ot", 1], ["block_col_warps", "ot", 1], ["warp_row_tiles", "ot", 4], ["warp_col_tiles", "ot", 16], ["chunk", "ot", 8], ["fuse_pack", "ot", 0], ["split_block_k", "ot", 4], ["vector_ws", "ot", 8], ["vector_as", "ot", 1], ["reorder_inner", "re", [1, 0]], ["compute_at_AS", "ot", 3], ["compute_at_WS", "ot", 0], ["AS_double_buffer", "ot", 1], ["WS_double_buffer", "ot", 0], ["auto_unroll_max_step", "ot", 512]]}, "result": [[7.545456371134021e-05], 0, 1.9669685363769531, 1597262584.899628], "version": 0.2, "tvm_version": "0.7.dev1"}
{"input": ["cuda", "conv2d_HWNCnc_tensorcore.cuda", [["TENSOR", [14, 14, 8, 1024], "uint4"], ["TENSOR", [1, 1, 512, 1024], "int4"], [2, 2], [0, 0, 0, 0], [1, 1], "int32"], {}], "config": {"index": 20975265, "code_hash": null, "entity": [["block_row_warps", "ot", 1], ["block_col_warps", "ot", 1], ["warp_row_tiles", "ot", 1], ["warp_col_tiles", "ot", 4], ["chunk", "ot", 8], ["fuse_pack", "ot", 1], ["split_block_k", "ot", 1], ["vector_ws", "ot", 1], ["vector_as", "ot", 16], ["reorder_inner", "re", [1, 0]], ["compute_at_AS", "ot", 1], ["compute_at_WS", "ot", 0], ["AS_double_buffer", "ot", 0], ["WS_double_buffer", "ot", 1], ["auto_unroll_max_step", "ot", 1500]]}, "result": [[3.3352796670880736e-05], 0, 1.7339842319488525, 1597116931.7082293], "version": 0.2, "tvm_version": "0.7.dev1"}
{"input": ["cuda", "conv2d_HWNCnc_tensorcore.cuda", [["TENSOR", [16, 16, 8, 256], "uint4"], ["TENSOR", [3, 3, 256, 256], "int4"], [1, 1], [0, 0, 0, 0], [1, 1], "int32"], {}], "config": {"index": 24067635, "code_hash": null, "entity": [["block_row_warps", "ot", 1], ["block_col_warps", "ot", 4], ["warp_row_tiles", "ot", 2], ["warp_col_tiles", "ot", 2], ["chunk", "ot", 8], ["fuse_pack", "ot", 1], ["split_block_k", "ot", 4], ["vector_ws", "ot", 1], ["vector_as", "ot", 8], ["reorder_inner", "re", [1, 0]], ["compute_at_AS", "ot", 1], ["compute_at_WS", "ot", 2], ["AS_double_buffer", "ot", 1], ["WS_double_buffer", "ot", 1], ["auto_unroll_max_step", "ot", 1500]]}, "result": [[7.454270795180724e-05], 0, 2.7434487342834473, 1597114294.7642243], "version": 0.2, "tvm_version": "0.7.dev1"}
{"input": ["cuda", "conv2d_HWNCnc_tensorcore.cuda", [["TENSOR", [14, 14, 8, 1024], "uint4"], ["TENSOR", [1, 1, 256, 1024], "int4"], [1, 1], [0, 0, 0, 0], [1, 1], "int32"], {}], "config": {"index": 17442441, "code_hash": null, "entity": [["block_row_warps", "ot", 1], ["block_col_warps", "ot", 1], ["warp_row_tiles", "ot", 16], ["warp_col_tiles", "ot", 16], ["chunk", "ot", 2], ["fuse_pack", "ot", 0], ["split_block_k", "ot", 1], ["vector_ws", "ot", 8], ["vector_as", "ot", 1], ["reorder_inner", "re", [1, 0]], ["compute_at_AS", "ot", 2], ["compute_at_WS", "ot", 1], ["AS_double_buffer", "ot", 0], ["WS_double_buffer", "ot", 0], ["auto_unroll_max_step", "ot", 1500]]}, "result": [[3.6509391680299135e-05], 0, 1.8386621475219727, 1597112316.6545196], "version": 0.2, "tvm_version": "0.7.dev1"}
{"input": ["cuda", "conv2d_HWNCnc_tensorcore.cuda", [["TENSOR", [28, 28, 8, 512], "uint4"], ["TENSOR", [1, 1, 256, 512], "int4"], [2, 2], [0, 0, 0, 0], [1, 1], "int32"], {}], "config": {"index": 22230588, "code_hash": null, "entity": [["block_row_warps", "ot", 1], ["block_col_warps", "ot", 2], ["warp_row_tiles", "ot", 1], ["warp_col_tiles", "ot", 8], ["chunk", "ot", 4], ["fuse_pack", "ot", 0], ["split_block_k", "ot", 4], ["vector_ws", "ot", 1], ["vector_as", "ot", 1], ["reorder_inner", "re", [1, 0]], ["compute_at_AS", "ot", 3], ["compute_at_WS", "ot", 2], ["AS_double_buffer", "ot", 0], ["WS_double_buffer", "ot", 1], ["auto_unroll_max_step", "ot", 1500]]}, "result": [[1.76145944808232e-05], 0, 3.0776169300079346, 1597110674.7290645], "version": 0.2, "tvm_version": "0.7.dev1"}
{"input": ["cuda", "conv2d_HWNCnc_tensorcore.cuda", [["TENSOR", [28, 28, 8, 512], "uint4"], ["TENSOR", [1, 1, 128, 512], "int4"], [1, 1], [0, 0, 0, 0], [1, 1], "int32"], {}], "config": {"index": 19118199, "code_hash": null, "entity": [["block_row_warps", "ot", 1], ["block_col_warps", "ot", 2], ["warp_row_tiles", "ot", 16], ["warp_col_tiles", "ot", 8], ["chunk", "ot", 2], ["fuse_pack", "ot", 0], ["split_block_k", "ot", 2], ["vector_ws", "ot", 1], ["vector_as", "ot", 1], ["reorder_inner", "re", [1, 0]], ["compute_at_AS", "ot", 3], ["compute_at_WS", "ot", 0], ["AS_double_buffer", "ot", 1], ["WS_double_buffer", "ot", 0], ["auto_unroll_max_step", "ot", 1500]]}, "result": [[3.579011020677519e-05], 0, 2.809098958969116, 1597106542.114712], "version": 0.2, "tvm_version": "0.7.dev1"}
{"input": ["cuda", "conv2d_HWNCnc_tensorcore.cuda", [["TENSOR", [56, 56, 8, 256], "uint4"], ["TENSOR", [1, 1, 128, 256], "int4"], [2, 2], [0, 0, 0, 0], [1, 1], "int32"], {}], "config": {"index": 18083649, "code_hash": null, "entity": [["block_row_warps", "ot", 1], ["block_col_warps", "ot", 2], ["warp_row_tiles", "ot", 16], ["warp_col_tiles", "ot", 8], ["chunk", "ot", 8], ["fuse_pack", "ot", 0], ["split_block_k", "ot", 4], ["vector_ws", "ot", 1], ["vector_as", "ot", 1], ["reorder_inner", "re", [1, 0]], ["compute_at_AS", "ot", 3], ["compute_at_WS", "ot", 2], ["AS_double_buffer", "ot", 0], ["WS_double_buffer", "ot", 0], ["auto_unroll_max_step", "ot", 1500]]}, "result": [[2.0697588039014372e-05], 0, 2.28279709815979, 1597104627.411465], "version": 0.2, "tvm_version": "0.7.dev1"}
{"input": ["cuda", "conv2d_HWNCnc_tensorcore.cuda", [["TENSOR", [16, 16, 8, 512], "int8"], ["TENSOR", [3, 3, 512, 512], "int8"], [2, 2], [0, 0, 0, 0], [1, 1], "int32"], {}], "config": {"index": 9635293, "code_hash": null, "entity": [["block_row_warps", "ot", 2], ["block_col_warps", "ot", 1], ["warp_row_tiles", "ot", 8], ["warp_col_tiles", "ot", 4], ["chunk", "ot", 8], ["fuse_pack", "ot", 1], ["split_block_k", "ot", 1], ["vector_ws", "ot", 1], ["vector_as", "ot", 16], ["reorder_inner", "re", [0, 1]], ["compute_at_AS", "ot", 2], ["compute_at_WS", "ot", 2], ["AS_double_buffer", "ot", 0], ["WS_double_buffer", "ot", 0], ["auto_unroll_max_step", "ot", 512]]}, "result": [[0.00019142662107904642], 0, 2.7781007289886475, 1597242969.7510476], "version": 0.2, "tvm_version": "0.7.dev1"}
{"input": ["cuda", "conv2d_HWNCnc_tensorcore.cuda", [["TENSOR", [14, 14, 8, 1024], "int8"], ["TENSOR", [1, 1, 512, 1024], "int8"], [1, 1], [0, 0, 0, 0], [1, 1], "int32"], {}], "config": {"index": 6524424, "code_hash": null, "entity": [["block_row_warps", "ot", 1], ["block_col_warps", "ot", 1], ["warp_row_tiles", "ot", 2], ["warp_col_tiles", "ot", 4], ["chunk", "ot", 2], ["fuse_pack", "ot", 1], ["split_block_k", "ot", 1], ["vector_ws", "ot", 1], ["vector_as", "ot", 16], ["reorder_inner", "re", [0, 1]], ["compute_at_AS", "ot", 2], ["compute_at_WS", "ot", 0], ["AS_double_buffer", "ot", 1], ["WS_double_buffer", "ot", 1], ["auto_unroll_max_step", "ot", 0]]}, "result": [[0.00015381613056092842], 0, 1.6599528789520264, 1597240930.748147], "version": 0.2, "tvm_version": "0.7.dev1"}
{"input": ["cuda", "conv2d_HWNCnc_tensorcore.cuda", [["TENSOR", [14, 14, 8, 256], "int8"], ["TENSOR", [1, 1, 1024, 256], "int8"], [1, 1], [0, 0, 0, 0], [1, 1], "int32"], {}], "config": {"index": 17589417, "code_hash": null, "entity": [["block_row_warps", "ot", 1], ["block_col_warps", "ot", 4], ["warp_row_tiles", "ot", 16], ["warp_col_tiles", "ot", 1], ["chunk", "ot", 8], ["fuse_pack", "ot", 1], ["split_block_k", "ot", 8], ["vector_ws", "ot", 1], ["vector_as", "ot", 8], ["reorder_inner", "re", [1, 0]], ["compute_at_AS", "ot", 3], ["compute_at_WS", "ot", 1], ["AS_double_buffer", "ot", 0], ["WS_double_buffer", "ot", 0], ["auto_unroll_max_step", "ot", 1500]]}, "result": [[6.60067577383409e-05], 0, 2.0917866230010986, 1597240188.276374], "version": 0.2, "tvm_version": "0.7.dev1"}
{"input": ["cuda", "conv2d_HWNCnc_tensorcore.cuda", [["TENSOR", [14, 14, 8, 1024], "int8"], ["TENSOR", [1, 1, 256, 1024], "int8"], [1, 1], [0, 0, 0, 0], [1, 1], "int32"], {}], "config": {"index": 6437154, "code_hash": null, "entity": [["block_row_warps", "ot", 1], ["block_col_warps", "ot", 2], ["warp_row_tiles", "ot", 16], ["warp_col_tiles", "ot", 4], ["chunk", "ot", 2], ["fuse_pack", "ot", 0], ["split_block_k", "ot", 1], ["vector_ws", "ot", 1], ["vector_as", "ot", 8], ["reorder_inner", "re", [1, 0]], ["compute_at_AS", "ot", 1], ["compute_at_WS", "ot", 0], ["AS_double_buffer", "ot", 1], ["WS_double_buffer", "ot", 1], ["auto_unroll_max_step", "ot", 0]]}, "result": [[6.2530021179402e-05], 0, 1.5623161792755127, 1597237370.8364513], "version": 0.2, "tvm_version": "0.7.dev1"}
{"input": ["cuda", "conv2d_HWNCnc_tensorcore.cuda", [["TENSOR", [30, 30, 8, 256], "int8"], ["TENSOR", [3, 3, 256, 256], "int8"], [2, 2], [0, 0, 0, 0], [1, 1], "int32"], {}], "config": {"index": 16417398, "code_hash": null, "entity": [["block_row_warps", "ot", 1], ["block_col_warps", "ot", 2], ["warp_row_tiles", "ot", 1], ["warp_col_tiles", "ot", 2], ["chunk", "ot", 4], ["fuse_pack", "ot", 1], ["split_block_k", "ot", 1], ["vector_ws", "ot", 1], ["vector_as", "ot", 8], ["reorder_inner", "re", [1, 0]], ["compute_at_AS", "ot", 2], ["compute_at_WS", "ot", 3], ["AS_double_buffer", "ot", 1], ["WS_double_buffer", "ot", 1], ["auto_unroll_max_step", "ot", 512]]}, "result": [[0.00015312326750972763], 0, 2.566988945007324, 1597235253.8515537], "version": 0.2, "tvm_version": "0.7.dev1"}
{"input": ["cuda", "conv2d_HWNCnc_tensorcore.cuda", [["TENSOR", [28, 28, 8, 512], "int8"], ["TENSOR", [1, 1, 256, 512], "int8"], [1, 1], [0, 0, 0, 0], [1, 1], "int32"], {}], "config": {"index": 18107781, "code_hash": null, "entity": [["block_row_warps", "ot", 1], ["block_col_warps", "ot", 4], ["warp_row_tiles", "ot", 1], ["warp_col_tiles", "ot", 1], ["chunk", "ot", 8], ["fuse_pack", "ot", 1], ["split_block_k", "ot", 8], ["vector_ws", "ot", 1], ["vector_as", "ot", 8], ["reorder_inner", "re", [1, 0]], ["compute_at_AS", "ot", 3], ["compute_at_WS", "ot", 2], ["AS_double_buffer", "ot", 0], ["WS_double_buffer", "ot", 0], ["auto_unroll_max_step", "ot", 1500]]}, "result": [[0.0001291390576642336], 0, 3.025306463241577, 1597233612.5677142], "version": 0.2, "tvm_version": "0.7.dev1"}
{"input": ["cuda", "conv2d_HWNCnc_tensorcore.cuda", [["TENSOR", [58, 58, 8, 128], "int8"], ["TENSOR", [3, 3, 128, 128], "int8"], [2, 2], [0, 0, 0, 0], [1, 1], "int32"], {}], "config": {"index": 4947444, "code_hash": null, "entity": [["block_row_warps", "ot", 1], ["block_col_warps", "ot", 1], ["warp_row_tiles", "ot", 2], ["warp_col_tiles", "ot", 8], ["chunk", "ot", 1], ["fuse_pack", "ot", 1], ["split_block_k", "ot", 1], ["vector_ws", "ot", 1], ["vector_as", "ot", 8], ["reorder_inner", "re", [0, 1]], ["compute_at_AS", "ot", 2], ["compute_at_WS", "ot", 1], ["AS_double_buffer", "ot", 0], ["WS_double_buffer", "ot", 1], ["auto_unroll_max_step", "ot", 0]]}, "result": [[0.00016550361578400832], 0, 1.6581640243530273, 1597227651.8154116], "version": 0.2, "tvm_version": "0.7.dev1"}
{"input": ["cuda", "conv2d_HWNCnc_tensorcore.cuda", [["TENSOR", [56, 56, 8, 256], "int8"], ["TENSOR", [1, 1, 128, 256], "int8"], [1, 1], [0, 0, 0, 0], [1, 1], "int32"], {}], "config": {"index": 5918940, "code_hash": null, "entity": [["block_row_warps", "ot", 1], ["block_col_warps", "ot", 1], ["warp_row_tiles", "ot", 1], ["warp_col_tiles", "ot", 4], ["chunk", "ot", 4], ["fuse_pack", "ot", 0], ["split_block_k", "ot", 1], ["vector_ws", "ot", 1], ["vector_as", "ot", 8], ["reorder_inner", "re", [1, 0]], ["compute_at_AS", "ot", 1], ["compute_at_WS", "ot", 3], ["AS_double_buffer", "ot", 0], ["WS_double_buffer", "ot", 1], ["auto_unroll_max_step", "ot", 0]]}, "result": [[0.00018390364692482918], 0, 1.9767248630523682, 1597225903.09978], "version": 0.2, "tvm_version": "0.7.dev1"}
{"input": ["cuda", "conv2d_HWNCnc_tensorcore.cuda", [["TENSOR", [28, 28, 8, 512], "int8"], ["TENSOR", [1, 1, 256, 512], "int8"], [2, 2], [0, 0, 0, 0], [1, 1], "int32"], {}], "config": {"index": 2311527, "code_hash": null, "entity": [["block_row_warps", "ot", 1], ["block_col_warps", "ot", 2], ["warp_row_tiles", "ot", 2], ["warp_col_tiles", "ot", 4], ["chunk", "ot", 2], ["fuse_pack", "ot", 0], ["split_block_k", "ot", 1], ["vector_ws", "ot", 1], ["vector_as", "ot", 16], ["reorder_inner", "re", [1, 0]], ["compute_at_AS", "ot", 1], ["compute_at_WS", "ot", 0], ["AS_double_buffer", "ot", 1], ["WS_double_buffer", "ot", 0], ["auto_unroll_max_step", "ot", 0]]}, "result": [[3.399951169888098e-05], 0, 2.181135416030884, 1597146174.4022374], "version": 0.2, "tvm_version": "0.7.dev1"}
